asin,title,imgUrl,price,stars,isBestSeller,boughtInLastMonth,category_name
B0CFKLZ4QM,Florida Icons Cosmetic Bag Relocation Gift Florida Travel Makeup Bag Beach Lover Gift (Florida),https://m.media-amazon.com/images/I/71qIdIzR8JL._AC_UL320_.jpg,13.66,0.0,False,0,Travel Accessories
B0CCLL4TLF,"H Cone - Paste For Face, Hair and Body for Cosmetic look and Temporary Tattoos",https://m.media-amazon.com/images/I/715Ucy5x8bL._AC_UL320_.jpg,37.49,5.0,False,0,Travel Accessories
B07RDJPQ3G,sincewo Travel Bottles Travel Containers TSA Approved Travel Size Toiletries Containers 3oz Leak Leakproof Silicone Travel Bottles for Shampoo Conditioner Lotion Face Body Wash (6 Pack White),https://m.media-amazon.com/images/I/41YeSifeokL._AC_UL320_.jpg,16.99,4.4,False,0,Travel Accessories
B0B4W99RGV,"9 Pack Plastic Lotion Dispenser, 17 oz Empty Bottles with Pump, Refillable Liquid Container for Dispensing Lotions, Shampoo, Massage Oil, Dish Soap, Bathroom, Kitchen Sink",https://m.media-amazon.com/images/I/515QANNaIRL._AC_UL320_.jpg,16.99,4.2,False,0,Travel Accessories
B0BV284MYG,Large Capacity Travel Cosmetic Bag Flat Lay Makeup Organizer Bag Waterproof PU Leather Makeup Bag Portable Checkered Makeup Bag Open Flat Toiletry Bag with Handle Divider for Women (white),https://m.media-amazon.com/images/I/61gYmq9nAzL._AC_UL320_.jpg,15.98,4.4,False,0,Travel Accessories
B09C1YN4S8,Hockey Mom Gifts Hockey Makeup Bag Ice Hockey Player Gift for Mom Hockey Travel Cosmetic Bag Toiletry Organizer Case Zipper Pouch (Hockey Mom bag),https://m.media-amazon.com/images/I/71eTw-MXsaL._AC_UL320_.jpg,9.99,4.5,False,0,Travel Accessories
B09QHB1YS2,"16 Ounce Cosmo Round Bottles, PET Plastic Empty Refillable BPA-Free, with Black/Natural Twist Top Caps (Pack of 10) (Amber)",https://m.media-amazon.com/images/I/71C+zZXFzuL._AC_UL320_.jpg,24.99,4.7,False,0,Travel Accessories
B0B4VBBVTM,"12 pieces Friend Appreciation Gifts Set 6 Good Friend Gifts Cosmetic Bag and 6 Good Friend Keychains Appreciation Funny Long Distance Friendship Gifts, Christmas Gifts for Best Soul Sister",https://m.media-amazon.com/images/I/81NIuZwOA4L._AC_UL320_.jpg,19.99,4.8,False,50,Travel Accessories
B0B194JW72,Men's Western Rodeo Fashion Sunflower Hand-Tooled Genuine Leather Cowhide Travel Toiletry Dopp Kit Bag 18FK01,https://m.media-amazon.com/images/I/71G3xX4E4TL._AC_UL320_.jpg,84.99,4.4,False,0,Travel Accessories
B099MYSK5Q,"10 Pieces Nurse Survival Kit Makeup Bags, Best Nurse Ever Cosmetic Bag, Nurse Practitioner Gifts Toiletry Bag, Funny Travel Bag Nurses School Supplies Gifts Nursing Student Gifts",https://m.media-amazon.com/images/I/81gNWinnawL._AC_UL320_.jpg,17.99,4.8,False,0,Travel Accessories
B086QP5QMG,"dedoot Clear Spray Bottle for Hair, Plant Mister Spray Bottle, 2 Pack Empty Small 7oz Plastic Refillable Trigger Sprayer, Leak Proof Spray Bottles for Cleaning Solutions, Hair Care, Essential Oils",https://m.media-amazon.com/images/I/51BHT+WHKiL._AC_UL320_.jpg,7.99,4.2,False,50,Travel Accessories
B0C7BM1GST,Large Makeup Bags Mesh Makeup Bag Clear Toiletry Bag Black Mesh Makeup Organizer Cosmetic Organizer Case Make up Bags for Women,https://m.media-amazon.com/images/I/71uZWEHeAUL._AC_UL320_.jpg,12.99,0.0,False,0,Travel Accessories
B0BPMKDNT4,Cosmetic bag - check pattern cosmetic bag - waterproof portable skincare bag - large capacity cosmetic bag for women - with handle separator - white - fashion (White),https://m.media-amazon.com/images/I/71t-hVYAtUL._AC_UL320_.jpg,18.99,3.9,False,50,Travel Accessories
B0BJ2GCW7D,"Preppy Patch Makeup Bag Baby Pouch, Chenille Letter Make Up Bag, Clear Small Travel Makeup Zipper Pouch Purse, Glitter Travel Toiletry Bag Nylon Organizer Zipper Pouch Cosmetic Purse for Women Girls",https://m.media-amazon.com/images/I/71jiT4hVkQL._AC_UL320_.jpg,15.99,4.8,False,0,Travel Accessories
B07MV4YDRK,2PCS 5g/5ml/0.17oz Empty Upscale Frosted Glass Cream Jar Bottle Cosmetic Dispenser Refillable Container Pot Vial Holder Sample Storage with Eco Bamboo Lid For Eye Cream Lotion Ointments Lip Balm,https://m.media-amazon.com/images/I/51cm5CZvgaL._AC_UL320_.jpg,8.97,4.7,False,0,Travel Accessories
B0B4W5N51T,Personalized Gifts for Women Unique Birthday Gifts for Mother Teachers Friends Embroidery Cosmetic Bag with Inner Pocket Toiletry Bag Letter A,https://m.media-amazon.com/images/I/71hWsNix6SL._AC_UL320_.jpg,11.99,4.8,False,0,Travel Accessories
B092QZCQ4R,"Hanging Travel Toiletry Bag, Visible Makeup Organizer, Makeup Case for Travel Accessories, Bathroom Shower, Black",https://m.media-amazon.com/images/I/71Sch0A6CeL._AC_UL320_.jpg,21.99,4.7,False,50,Travel Accessories
B0CBC2VJSW,"RAWR Means I Love You in Dinosaur Cosmetic Bag, Funny Cute Dinosaur Themed Makeup Bag Zipper Cosmetic Pouch Bag Travel Linen Makeup Organizer, Forest Animals Gifts for Dinosaur Lover Women Girls",https://m.media-amazon.com/images/I/81k2N1V0qRL._AC_UL320_.jpg,11.99,0.0,False,0,Travel Accessories
B0B73YHDD9,"Small Pump Bottles 1 oz Travel Size Leakproof Pump Bottles for Lotion, Shampoo , Essential Oil and Other Toiletries with Bottle Label",https://m.media-amazon.com/images/I/616XGM4COOL._AC_UL320_.jpg,6.49,4.1,False,100,Travel Accessories
B0C6TFRSWW,"APACALI 100PCS Plastic Travel Bottles 1oz Mini Shampoo Bottles Small Empty Bottles Refillable Cosmetic Containers with Flip Cap Clear Portable Small Bottles for Liquid, Lotions, Toner, Body Soap",https://m.media-amazon.com/images/I/71hnstfEEEL._AC_UL320_.jpg,24.99,4.3,False,0,Travel Accessories
B09QM4TWJ5,Travel Cosmetic Bag Cute Hedgehog Heart Print Toiletry Makeup Bag Pouch Tote Case Organizer Storage For Women Girls,https://m.media-amazon.com/images/I/61YcMjK8pLL._AC_UL320_.jpg,20.99,4.5,False,0,Travel Accessories
B0BKKFL1QK,Cousin Birthday Gift Makeup Bags Cousin Gifts for Women Cosmetic Bag Sister Gift Best Friend Gift Long Distance Relationship Gift for Cousin Graduation Gift for Her Sibling Gift Travel Makeup Pouch,https://m.media-amazon.com/images/I/71tVE-YnmzL._AC_UL320_.jpg,9.99,4.6,False,0,Travel Accessories
B08KXY32VJ,Pink Glass Essential Oil Roller-on Bottles with Stainless Steel Roller Balls 5ml Pearlescent Vials for Perfume Aromatherapy Oils Pack of 18 (Opener Pendant Included),https://m.media-amazon.com/images/I/71CTuXfF3gL._AC_UL320_.jpg,14.88,4.4,False,0,Travel Accessories
B0CCDXV927,Hilo wash bag - Waterproof Wash Bag for Men and Women - Wash Bag for Travel (Grey),https://m.media-amazon.com/images/I/41kc4b4FvjL._AC_UL320_.jpg,50.0,5.0,False,0,Travel Accessories
B0C4NVSJVJ,"2 Pcs Makeup Bags For Women, Cute Cosmetic Bags For Purse Small Makeup Pouch Travel Makeup Bag with Zipper Make Up Bag for Travelling",https://m.media-amazon.com/images/I/61w3OknKpmL._AC_UL320_.jpg,9.99,4.6,False,50,Travel Accessories
B073FHMGMG,"Signature Dopp Portable Travel Bag Made from Plush Premium Genuine Leather - Durable, Waterproof, Fully Washable, Tough and Timeless - Stain Resistant Men's Toiletry Bag with Strap",https://m.media-amazon.com/images/I/811Hr1Ob+GL._AC_UL320_.jpg,69.99,4.7,False,0,Travel Accessories
B0BG6WP8XC,AEDIKO 20pcs TP4056 Type-C USB 5V 1A 18650 Lithium Battery Charger Module Li-ion Charging Board TC4056A with Dual Protection Function,https://m.media-amazon.com/images/I/81Ck7ZY6ZPL._AC_UL320_.jpg,9.99,4.2,False,0,Travel Accessories
B0BZRWMQF7,48 Pcs Appreciation Makeup Cosmetic Bag with Keychains Inspirational Gifts for Women Motivational Gifts for Coworkers Makeup Pouches Bulk with Zipper for Friends Employee (Classic Style),https://m.media-amazon.com/images/I/81DTYpHeDZL._AC_UL320_.jpg,28.99,4.6,False,0,Travel Accessories
B0C8TBB26K,WLLHYF Squeeze Bottles 2 Pack 200 ML Refillable Plastic Travel Containers Empty Bottles With Disc Top Flip Cap Travel Accessories for Shampoo Creams Lotion Conditioner,https://m.media-amazon.com/images/I/51RwMJ2IIjL._AC_UL320_.jpg,7.28,5.0,False,0,Travel Accessories
B0BY7949DF,"4Pcs Holographic Makeup Bag,Makeup Bag for Purse&Clear Makeup Bag Cosmetic Bag Hand Carry Bag Coin Purse for Women",https://m.media-amazon.com/images/I/6157XpTr93L._AC_UL320_.jpg,9.99,5.0,False,0,Travel Accessories
B0CBLRMCSH,"8Pcs Pocket Cosmetic Bag, 2 Size Small Makeup Bag for Purse, Squeeze Top Self-closing Travel Mini Makeup Pouch for Women, Portable PU Leather Small Storage bag for Headphones Jewelry",https://m.media-amazon.com/images/I/71vx0sGeOhL._AC_UL320_.jpg,10.98,0.0,False,0,Travel Accessories
B00WZ93BLE,Tapestry Cosmetic Bag Toiletry Makeup Bag for Women With Cat Design (COSM-CAT),https://m.media-amazon.com/images/I/81oDDyI9PBL._AC_UL320_.jpg,20.99,4.6,False,0,Travel Accessories
B0BCHMDK8P,"3 Pieces Clear Makeup Bags Chenille Letter Pouch DIY Clear Travel Pouch Zipper Clear Pouch Waterproof Chenille Letter Bag Transparent Nylon Toiletry Bag for Women Girls, Pink, White, Black",https://m.media-amazon.com/images/I/51Kf5XIIJeL._AC_UL320_.jpg,14.99,4.3,False,0,Travel Accessories
B0BMTKXWC2,"15 inch Kids Backpack for School Boys Girls, Cute Lightweight Children Bookbag with Adjustable Padded Straps, Lime Green",https://m.media-amazon.com/images/I/61JHYV5aisL._AC_UL320_.jpg,22.99,4.4,False,0,Backpacks
B0BZ8FK16Q,"Galaxy Backpack for Boys with Lunch Box Set, 3Pcs Boys Bookbag for Elementary, 3 in 1 Teens Space Printed School Bag",https://m.media-amazon.com/images/I/6112f9IGVrL._AC_UL320_.jpg,28.98,4.0,False,0,Backpacks
B0CD5N27WT,Vogue Large RFID Backpack,https://m.media-amazon.com/images/I/81-gx3n9MFL._AC_UL320_.jpg,98.0,0.0,False,0,Backpacks
B09BVDVQCJ,Geometric Prints Rolling Backpack for Boys Side-Opening Daypack with Wheels Student Travel Bag,https://m.media-amazon.com/images/I/51R7z-rrYAL._AC_UL320_.jpg,30.09,4.2,False,0,Backpacks
B082P1LGJX,Kanken Sling,https://m.media-amazon.com/images/I/715THJV4oiL._AC_UL320_.jpg,52.52,4.5,False,0,Backpacks
B0BPY9X3V2,Butterfly Mushroom Mini Backpacks for Girls Teen Round Purses Small Crossbody Bags School Bags Travel Daypack Trip Shoulder Bag Moon Night Tote Handbags Purple Messenger Bags,https://m.media-amazon.com/images/I/61TwlEhUpHL._AC_UL320_.jpg,23.99,0.0,False,0,Backpacks
B0C2M5XNBZ,Sling Bag Anti-theft Crossbody Shoulder Bag Chest Backpack Casual Daypack for Men Women,https://m.media-amazon.com/images/I/71sNSuzm08L._AC_UL320_.jpg,12.99,4.3,False,100,Backpacks
B0B61BYTN3,"Kids Backpack For Girls,Unicorn Backpack Preschool Book Bag Kindergarten Bookbag With Lunchbox School Bag",https://m.media-amazon.com/images/I/71XC3lwKU1L._AC_UL320_.jpg,31.99,4.7,False,0,Backpacks
B09Z6PYFPC,Butterflies Sling Bag Crossbody Sling Backpack for Women Men Travel Hiking Daypack Chest Shoulder Bag,https://m.media-amazon.com/images/I/71r88-iqDhL._AC_UL320_.jpg,19.99,4.5,False,0,Backpacks
B0C497YWYM,"Large Capacity Lightweight Simple Personality Design Premium Material Durable 17"" Backpack Boys Girls Shoulder Bags",https://m.media-amazon.com/images/I/51w+Xa0Ix1L._AC_UL320_.jpg,19.99,0.0,False,0,Backpacks
B0BY8T1D58,Funny Mic.key Mouse Teens Backpack 3Pcs Travel Laptop Schoolbag Sets Daypack with Lunch Box And Pencil Case for Boys Girls Gifts,https://m.media-amazon.com/images/I/71f07-j+peL._AC_UL320_.jpg,38.99,0.0,False,0,Backpacks
B0C3VT8CRB,Tapestry Women Backpack Rucksack Casual Daypack With Paddington Bear Design (DAPK-PADD),https://m.media-amazon.com/images/I/71wICqpv9VL._AC_UL320_.jpg,45.0,0.0,False,0,Backpacks
B09Z362XMY,"Special Edition Voyager Kit Pack Back Pack Waterproof & Puncture Resistant for Water Sport, Gym, Beach, Boating, Travel",https://m.media-amazon.com/images/I/61-ksvDHcPL._AC_UL320_.jpg,94.95,0.0,False,0,Backpacks
B0BW4QYLZV,"Disney Ursula 11"" Vegan Leather Fashion Mini Backpack",https://m.media-amazon.com/images/I/91aQ8MkUGDL._AC_UL320_.jpg,85.0,5.0,False,0,Backpacks
B0BJQ1YM8M,"School Backpack for Girls, Girls Backpack with Lunch Box, Bookbag for Girls Kids Middle High School Student Schoolbag",https://m.media-amazon.com/images/I/71raqf0LR8L._AC_UL320_.jpg,36.99,4.6,False,50,Backpacks
B07XB5HX9Z,Kids Backpack Deer With Flower Arrows Preschool Bag for Toddler Boy Girls Schoolbag One Size,https://m.media-amazon.com/images/I/61VaRsibWYL._AC_UL320_.jpg,24.99,4.7,False,0,Backpacks
B0CB7KF99P,Daisy Backpack for School Backpack for Girls Backpack with Lunch Box Bookbag Set Kids Backpacks for Teen Girls (Black),https://m.media-amazon.com/images/I/81S3n8ZHRXL._AC_UL320_.jpg,48.99,5.0,False,0,Backpacks
B07BLNKPJX,Backpack Purse Women Ladies Fashion Casual Lightweight Shoulder Bag Travel Daypack,https://m.media-amazon.com/images/I/21zGouXsKML._AC_UL320_.jpg,24.99,4.4,False,50,Backpacks
B08BDZQ7JJ,"Disney Minnie Mouse Mini Backpack for Toddler Girls - 12"" Minnie Mouse Mini Backpack for Girls | Minnie Mouse Mini Bookbag",https://m.media-amazon.com/images/I/815GtiyJ95L._AC_UL320_.jpg,14.95,4.2,False,0,Backpacks
B086GVXXXN,Lightweight Foldable Backpack (Highland Cow Teal),https://m.media-amazon.com/images/I/71wOw-pZBLL._AC_UL320_.jpg,21.99,4.5,False,0,Backpacks
B0BRPR8M97,70L Camping Hiking Backpack with Rain Cover Waterproof Backpacking Backpack for Hiking Treeking Climbing Outdoor (ArmyGreen),https://m.media-amazon.com/images/I/71zwNI1greL._AC_UL320_.jpg,49.99,4.7,False,0,Backpacks
B0C77FWCQS,14L Hiking Backpack Lightweight Packable Hiking Daypack Water Resistant Lightweight Foldable Hiking Backpack for Travel Camping Outdoor Small Travel Outdoor Foldable Shoulder Bag (Black),https://m.media-amazon.com/images/I/41+efIiaxeL._AC_UL320_.jpg,6.59,2.7,False,0,Backpacks
B0BGDG9ZNX,Women PU Leather Fashion Backpack Daypack for Traveling (Pink),https://m.media-amazon.com/images/I/413zoWx-b3L._AC_UL320_.jpg,41.99,5.0,False,0,Backpacks
B0BYSF3X4L,"Rocket School Backpack for Kids 5-12 yrs,Space Theme Backpack Kindergarten School Bag,1",https://m.media-amazon.com/images/I/71iq5ykY3TL._AC_UL320_.jpg,20.99,5.0,False,0,Backpacks
B07W354QB9,Cabin Zero Classic 36L Black Sand Backpack,https://m.media-amazon.com/images/I/91b9KbLYoTL._AC_UL320_.jpg,89.99,4.0,False,0,Backpacks
B08T1LSRFZ,Disney Nightmare Before Christmas Backpack - Jack Big Face Disney 17 Inch Air Mesh Padded Bag (Jack Big Face),https://m.media-amazon.com/images/I/61ep3Q5bBNL._AC_UL320_.jpg,37.99,4.8,False,0,Backpacks
B0B4BDTJ19,School Backpack for Girls Backpack with Lunch Box School Bag Bookbag Aesthetic Cute Backpack Set for Teen Girls (Pink),https://m.media-amazon.com/images/I/81CDJitDh8L._AC_UL320_.jpg,48.99,4.5,False,0,Backpacks
B0BBR94DC1,Kids Backpack Blue,https://m.media-amazon.com/images/I/91XujtlRUiL._AC_UL320_.jpg,29.53,4.8,False,50,Backpacks
B07337B2D9,Urban Hemp Backpack | Original Hemp Backpack for All Genders | Includes Secret Pocket & Removable Airtight Poly Bag (Forest),https://m.media-amazon.com/images/I/81A-tKKr0ZL._AC_UL320_.jpg,87.99,4.8,False,0,Backpacks
B0BLT9DTV4,"Unisex Zigzag Hip Pack, Dusty Pink/Basalt, One Size",https://m.media-amazon.com/images/I/71ROG9dNGKL._AC_UL320_.jpg,33.0,0.0,False,0,Backpacks
B0CGXYJJHG,Disney Parks Mickey Mouse Halloween Glow-in-the-Dark Mini Backpack,https://m.media-amazon.com/images/I/61M9nLlAdSL._AC_UL320_.jpg,123.0,0.0,False,0,Backpacks
B0BY3HVDND,"Green Backpack and Lunch Box Matching Set for Boys and Girls, School Bag with Laptop Compartment and Insulated Lunch Box, Green Pixel",https://m.media-amazon.com/images/I/81HRHhwi+LL._AC_UL320_.jpg,44.99,4.7,False,0,Backpacks
B0C9T8SR26,"Sling Bag for Men and Women, Adjustable Crossbody Bag Shoulder Bag Sling Backpack Chest Bag Travel Hiking Daypacks",https://m.media-amazon.com/images/I/61MRb+qCRhL._AC_UL320_.jpg,19.98,0.0,False,0,Backpacks
B09PY92VDM,Kids Backpack Bookbags Daypack for Girls Boys Men Women,https://m.media-amazon.com/images/I/71I7ACw0n5L._AC_UL320_.jpg,15.99,5.0,False,0,Backpacks
B0BY7LKC1K,Backpack Travel Backpacks Bookbag for Women & Men Boys Girls School College Students Backpack Durable Water Resistant purple 18in,https://m.media-amazon.com/images/I/612pAlsAYyL._AC_UL320_.jpg,26.99,4.7,False,0,Backpacks
B0CCXXNX7W,Cartoon Backpack Unisex Travel Durable Multifunctional Casual Bag For Men Women (black),https://m.media-amazon.com/images/I/81lzp1cCRaL._AC_UL320_.jpg,25.99,4.2,False,0,Backpacks
B0C6D4WT2S,Mermaid Backpack for Girls Backpack with Lunch Box Set for Elementary Kindergarten Student Kids Clear School Bag for Girls,https://m.media-amazon.com/images/I/91uF-O66bYL._AC_UL320_.jpg,49.99,4.7,False,0,Backpacks
B0BZZSRNHX,"Men's Neocroc Backpack with Zipped Logo Straps, Green, One Size",https://m.media-amazon.com/images/I/A1NNr8rQd4L._AC_UL320_.jpg,56.61,0.0,False,0,Backpacks
B0C9VZCQLH,"Capybara Backpacks for Girls, Boys - 16 Inch Cute Backpack for School - Cartoon, Large Capacity, Durable, Lightweight Bookbag for Kids, Travel",https://m.media-amazon.com/images/I/61kFkfsZhNL._AC_UL320_.jpg,29.99,4.0,False,0,Backpacks
B00T22CAXC,Kaipak 38 - Women's,https://m.media-amazon.com/images/I/81fufvxy1NL._AC_UL320_.jpg,169.2,4.6,False,0,Backpacks
B0C5M5FSJK,"Toddler Backpack for Girls and Boys Children Kindergarten Preschool Bag Kids School Backpack with Chest Strap, Rainbow",https://m.media-amazon.com/images/I/71LVCNNRYBL._AC_UL320_.jpg,21.99,4.7,False,0,Backpacks
B07DYLLZ8L,"Packable Casual Daypack, Black/Black, 17.75"" x 12.5"", 24.5L",https://m.media-amazon.com/images/I/61-e4LnhuxL._AC_UL320_.jpg,42.91,4.3,False,0,Backpacks
B0CCTCFYZM,"1 pcs Cute Mini Little Yellow Duck Design Backpack, Chain Adjustable Strap Cartoon Fluffy Novelty Bag",https://m.media-amazon.com/images/I/51n+7obK4dL._AC_UL320_.jpg,10.29,0.0,False,0,Backpacks
B09XJZHTL2,Sling Crossbody Chest Bag: Over Shoulder Small Slim Cross Daypack Lightweight Backpack Front Side Pack Men Women,https://m.media-amazon.com/images/I/71AFdOEiN2L._AC_UL320_.jpg,18.99,4.3,False,0,Backpacks
B07GSH7L4K,x Nightmare Before Christmas Chibi Print Faux Leather Mini Backpack,https://m.media-amazon.com/images/I/7118RVKIwmL._AC_UL320_.jpg,79.95,4.7,False,0,Backpacks
B09N3CZP5P,Girls Cute Cat Rolling Backpack with Wheels Kids Luggage for Elementary Kindergarten Suitcase Trip Laptop Roller Backpack for Girls,https://m.media-amazon.com/images/I/817BUFCDPwL._AC_UL320_.jpg,59.99,4.5,False,0,Backpacks
B0C95B7H41,Jurassic Park Light Up T-Rex Escape Mini Backpack,https://m.media-amazon.com/images/I/71As2g2NgLL._AC_UL320_.jpg,95.0,4.9,False,0,Backpacks
B0B2P2RQL1,Waxed Canvas Slim Sling Bag Mini Casual Daypacks Backpack Durable Crossbody Chest Bag Outdoor Travel Hiking Cycling,https://m.media-amazon.com/images/I/61-163av7AL._AC_UL320_.jpg,27.99,4.0,False,0,Backpacks
B089NZ1BRC,Geometric Backpack Luminous Backpacks Holographic Reflective Bag Lumikay Bags Irredescent Rucksack Rainbow,https://m.media-amazon.com/images/I/81WxtGR86+L._AC_UL320_.jpg,28.99,4.6,False,0,Backpacks
B0C9PJ5R3J,Anime 1 Pack Backpack Boys Girls Waterproof Lightweight Single Backpack Travel Backpack,https://m.media-amazon.com/images/I/61wpUS8kG4L._AC_UL320_.jpg,34.88,0.0,False,0,Backpacks
B0CCMMD5DD,"Cute Backpack Set with Lunch Bag and Pencil Case, 3PCS Cartoon Backpack Sets for Girls Boys Black-1",https://m.media-amazon.com/images/I/71su48o+8LL._AC_UL320_.jpg,40.99,5.0,False,0,Backpacks
B0C9QPT2YL,Clear Backpack Stadium Approved Durable Heavy Duty PVC Transparent Backpacks (Black),https://m.media-amazon.com/images/I/71BDMrm4z7L._AC_UL320_.jpg,26.98,4.5,False,0,Backpacks
B0C2T9BK4Q,"Girls Backpack, 17"" School Kids Backpacks for Girls, Cute Unicorn Bookbag with Compartments for Elementary Middle School Girls Students(Purple)",https://m.media-amazon.com/images/I/71rq+rQxX7L._AC_UL320_.jpg,22.99,4.9,False,100,Backpacks
B0BXBYLYQL,"Nightmare Before Christmas 16"" PU Leather Deluxe Backpack",https://m.media-amazon.com/images/I/61Te3BFRHtL._AC_UL320_.jpg,0.0,0.0,False,0,Backpacks
B082P2HVJZ,Fjällräven Kånken Ochre/Chess Pattern One Size,https://m.media-amazon.com/images/I/61spZ0eHwrL._AC_UL320_.jpg,85.45,4.5,False,0,Backpacks
B0BXD75NM8,Sling Bag Crossbody Backpack Shoulder Hiking Daypack for Men Anti-Thief Chest Personal Pocket Outdoor Travel Bag,https://m.media-amazon.com/images/I/51e67gWhQQL._AC_UL320_.jpg,17.99,4.9,False,0,Backpacks
B0BMKW8XQX,"60s Hippie Magic Mushrooms Crossbody Bags Sling Bag for for Women Men, Cute Fashion Chest Bag Casual Small Shoulder Bags Travel Hiking Cycling Gym Sport Lightweight Daypack Adult Backpack",https://m.media-amazon.com/images/I/71Kp17RGucL._AC_UL320_.jpg,22.09,0.0,False,0,Backpacks
B0B4PWMWF1,"Batman All Over Print Logo Full Size 16"" Backpack",https://m.media-amazon.com/images/I/71iAX6MyMkL._AC_UL320_.jpg,24.99,3.7,False,50,Backpacks
B07KRBWXZ8,Women Backpack Fashion Shoulder Bag Daypack Travel Rucksack Bag Embroidery Elephant (Black),https://m.media-amazon.com/images/I/51Wu7Ki1jbL._AC_UL320_.jpg,24.99,3.8,False,0,Backpacks
B08BBXGNMM,35L Lightweight Foldable Waterproof Packable Travel Small Hiking Backpack Daypack for men women,https://m.media-amazon.com/images/I/71+BvzhSTnL._AC_UL320_.jpg,19.99,4.6,False,100,Backpacks
B01HJ1Z0MK,Disney Villains Womens Mini Backpack,https://m.media-amazon.com/images/I/71MDHHoBxVL._AC_UL320_.jpg,69.97,4.8,False,0,Backpacks
B0B6LH6GY8,"Compact Backpack, Noir",https://m.media-amazon.com/images/I/919l85wR8TL._AC_UL320_.jpg,107.53,0.0,False,0,Backpacks
B0C8CNSLWP,AYKHKYA Horror Backpack Comedy Novelty Backpack Unique Fashion Bag Outdoor Travel Daily Use Gifts.,https://m.media-amazon.com/images/I/61SNb9-Pm4L._AC_UL320_.jpg,20.99,3.6,False,0,Backpacks
B0BWK2BY7W,"Backpack, Black, OSFA",https://m.media-amazon.com/images/I/61bgrgdwbNL._AC_UL320_.jpg,26.55,1.0,False,0,Backpacks
B0C6FQMS2M,"Aesthetic Cute Kawaii Backpack with Kawaii Pin and Pendants Accessories, Mochilas Para Ninas Bookbag Waterproof Nylon Material | Durable & Adorable 17""",https://m.media-amazon.com/images/I/61RltYJAQsL._AC_UL320_.jpg,19.99,2.4,False,0,Backpacks
B08CNFJYQB,Kids Fashion School Backpack Large Capacity Durable Casual Daypack Rucksack,https://m.media-amazon.com/images/I/61ZCdIpWrrL._AC_UL320_.jpg,19.99,4.4,False,0,Backpacks
B07SFWT5G5,"Fashion Elementary Student School Bags- Cool Sports Car Pattern Every Boy's Dream, Durable School Backpacks Outdoor Daypack Travel Packback for Kids Boys Girls",https://m.media-amazon.com/images/I/71f9BHJxvyL._AC_UL320_.jpg,33.99,5.0,False,0,Backpacks
B0C7ZNN4F1,"Backpack for Girls, Kawaii Backpack Cute Aesthetic Backpack with Pin Accessories Plush Pendant, 17.7 Inch Backpack for School & Travel - Durable, Water Resistant (Black)",https://m.media-amazon.com/images/I/51MOwXO0OrL._AC_UL320_.jpg,19.99,4.4,False,0,Backpacks
B0786Z4692,Stohlquist Cruiser Recreational PFD - Women,https://m.media-amazon.com/images/I/81ZI8CD2VqL._AC_UL320_.jpg,64.95,4.5,False,0,Backpacks
B09BSVKVHZ,"Large Backpack for Women, Polyester Carry on Backpack Pocketbook Bag Travel Backpack Daypack",https://m.media-amazon.com/images/I/81Yr91ZlPZL._AC_UL320_.jpg,36.99,0.0,False,0,Backpacks
B0C4HFCXW9,3PCS Anime Backpack Set Cute Backpacks With Pencil Case Lunch Box Cool Sports Daypack Travel Bag Gifts for Women Men Adults,https://m.media-amazon.com/images/I/81bI9l493oL._AC_UL320_.jpg,39.99,0.0,False,0,Backpacks
B082NXLFW1,Evercat Equinox 2.0 Carrysack Dark Green One Size,https://m.media-amazon.com/images/I/81fRn+LLlKL._AC_UL320_.jpg,22.56,0.0,False,0,Backpacks
B0CCYX36H1,"Halloween Horror Movie Backpack, Multi-Function Travel Backpack, Adjustable Shoulder Strap Backpack 17""",https://m.media-amazon.com/images/I/817DjGFKuHL._AC_UL320_.jpg,29.99,5.0,False,0,Backpacks
B09SLPQSZQ,Hiking Backpack Ultralight Foldable Backpack Travel Camping Daypack Outdoor Sports Backpack,https://m.media-amazon.com/images/I/41vfRFVQBdL._AC_UL320_.jpg,7.53,4.0,False,0,Backpacks
B09PVKSLQY,Heavy Duty Semi-Transparent Mesh Backpack，See Through College Student Backpack,https://m.media-amazon.com/images/I/81Lz+-0Q+xL._AC_UL320_.jpg,18.99,4.6,False,50,Backpacks
B0CCL2D88M,"Clear Backpack for Girls Boys, Cartoon Heavy Duty Large Bookbag for School, Transparent See Through Bag for Kids Women for College Work Travel",https://m.media-amazon.com/images/I/817OMN6oSUL._AC_UL320_.jpg,21.99,5.0,False,0,Backpacks
B099SX8536,"Cosmo 6.5L - Black, One Size",https://m.media-amazon.com/images/I/91eh5Jryd0L._AC_UL320_.jpg,40.0,4.9,False,0,Backpacks
B07C8445MJ,"Meret SAVIOR7 PRO Combat Trauma System (Black), Standard",https://m.media-amazon.com/images/I/71cSFDhk7RL._AC_UL320_.jpg,315.0,5.0,False,0,Backpacks
B09ZQ3YMJ5,Disney Dumbo Wondapop 11 Inch Vegan Leather Mini Backpack,https://m.media-amazon.com/images/I/81M4wewtB-L._AC_UL320_.jpg,69.99,5.0,False,0,Backpacks
B08CTXHRP2,"Men's Voyager Backpack, Blackout, One Size",https://m.media-amazon.com/images/I/81T+ztf65nL._AC_UL320_.jpg,79.99,4.4,False,0,Backpacks
B0B5LD29H4,Shoulder Bag Cute Pink Pig Backpack Non Slip Tote Purse Lunch Bag with Pocket,https://m.media-amazon.com/images/I/51KcvssbxIL._AC_UL320_.jpg,11.99,5.0,False,0,Backpacks
B0836R4B2J,Canvas Sling Bag Small Crossbody Backpack Shoulder Casual Daypack Outdoor Cycling Hiking Travel XB-10,https://m.media-amazon.com/images/I/71sy6up+bQL._AC_UL320_.jpg,29.99,4.5,False,0,Backpacks
B001TIFIZ4,Monsoon Gearslinger,https://m.media-amazon.com/images/I/81o+zNa3XTL._AC_UL320_.jpg,156.16,4.6,False,0,Backpacks
B0BRTY535N,HT HONOR . TRUST Kids Backpack for School Girls Elementary Kindergarten Lightweight School Bag for Little Girl 15inch Pink Bookbag for Children,https://m.media-amazon.com/images/I/61eGK6S0whL._AC_UL320_.jpg,23.99,4.5,False,50,Backpacks
B096BLVJC9,"Insulated, Black/Red, One Size",https://m.media-amazon.com/images/I/81WlNVPOpOS._AC_UL320_.jpg,23.57,4.2,False,50,Backpacks
B0BLRL5BLR,"24 Pcs Clear Backpack Heavy Duty Clear Bookbags Clear Backpack Stadium Approved 16 Transparent See Through Backpacks for Stadium, Concert, Sports, Work, School, Security",https://m.media-amazon.com/images/I/815ofJA+qjL._AC_UL320_.jpg,174.99,5.0,False,0,Backpacks
B0BHPRTGGS,Utility Elite Printed Backpack 32L,https://m.media-amazon.com/images/I/81zXIctnEyL._AC_UL320_.jpg,0.0,4.7,False,0,Backpacks
