asin,title,imgUrl,price,stars,isBestSeller,boughtInLastMonth,category_name
B07VG9JY5Q,"Avengers Marvel Titan Hero Series Blast Gear Captain America, 12-Inch Toy, with Launcher, 2 Accessories and Projectile, Ages 4 and Up , Blue",https://m.media-amazon.com/images/I/811mbP1ahjS._AC_UL320_.jpg,14.99,4.7,False,100,Toys & Games
B07SVP35BV,"Fat Brain Toys F248 Fat Brain SpinnyPins, Kids Preschool, Spinning and Sorting Building Sets, Early Development Toy for Babies Aged 18 Months and Older, Multicoloured",https://m.media-amazon.com/images/I/61OPeSQVdML._AC_UL320_.jpg,33.99,4.8,False,100,Toys & Games
B0BFWTK6V9,"Age of Galaxy | Strategy Card Game | 4X Space Game | Board Games | Pocket Size, Travel and Family Friendly | 1-4 Players Board Game Adventure | 14+ Years",https://m.media-amazon.com/images/I/91Ax3mAcF4L._AC_UL320_.jpg,29.99,4.5,False,50,Toys & Games
B0C3L8TQ8P,Toyvian 2 Sets DIY Manipulator Toys for Kids Craft Toys Kids Mechanic Toys Robot Arm Reacher Robotic Hand Grabber Robot Arm Toy Child Game Toy Game for Kids DIY Toy Manual Red Plastic Arms,https://m.media-amazon.com/images/I/61AgcUFCy1L._AC_UL320_.jpg,9.21,0.0,False,0,Toys & Games
B0BBSJZ9CH,"LEGO Friends Dog Rescue Bike Building Set 41738, Pretend Play Animal Playset for Pet-Loving Kids, Girls and Boys Ages 6+ Years Old with Puppy Pet Figure and 2 Mini-Dolls, 2023 Series Characters",https://m.media-amazon.com/images/I/81MVNfyDGrL._AC_UL320_.jpg,9.39,4.8,False,1000,Toys & Games
B0BG62V59L,"14"" Dart Board for Kids, Basketball Hoop for Kids Toddlers, Sports & Outdoor Play Easter Gift Toys for Kids for 3 4 5 6 7 8 9 10 11 12 Year Old Boys Girls, Party Favors for Birthday",https://m.media-amazon.com/images/I/71YX6oJ4WAL._AC_UL320_.jpg,11.49,4.3,False,100,Toys & Games
B0C1JMKJ1Y,"6 Pack Airplane Launcher Toy with 2 Launcher,F-35 Foam LED Catapult Plane with 6 Stickers Kids Flying Toy,3 4 5 6 7 8 9 10 11 12 Year Old Boys Girls Gifts,Outdoor Sport Party Favor",https://m.media-amazon.com/images/I/81-ZMxRdIdL._AC_UL320_.jpg,28.99,4.2,False,50,Toys & Games
B096DLP51H,Girls Gifts Decorate Your Own Water Bottle with 14 Sheets of Unicorn Stickers & Glitter Gem. Cool Valentines Day Gifts for Kids & Easter Basket Stuffers for Girls Age 6 and Up,https://m.media-amazon.com/images/I/81SpYdQCOwS._AC_UL320_.jpg,15.99,4.5,False,50,Toys & Games
B08DHHJ88W,Spooktacular Creations Boys Scary Halloween Costume for Kids Zalgo Slenderman Rake Bodysuit Skinsuit Boys Girls Halloween Dress up Party (Large(10-12 yr)) Black,https://m.media-amazon.com/images/I/61mqCgRXVsL._AC_UL320_.jpg,28.99,4.3,False,50,Toys & Games
B079NL1Z5Q,"Doc McStuffins Pet Rescue On-the-Go Carrier, Oliver, Officially Licensed Kids Toys for Ages 3 Up by Just Play",https://m.media-amazon.com/images/I/71mFnYM5vqL._AC_UL320_.jpg,20.99,4.7,False,0,Toys & Games
B087RJ3MFZ,"Toddler Activity Cube, 6 in 1 Busy Learning Shape Sorter Toy with Music Keyboard, Gear, Sound & Light, Early Educational Toy Birthday Gifts for Baby Toddlers Children Boys Girls Age 1-3",https://m.media-amazon.com/images/I/615MnG-3VFL._AC_UL320_.jpg,39.99,4.6,False,0,Toys & Games
B0B3FVJQH1,"Transformers Toys Legacy Evolution Deluxe Scraphook Toy, 5.5-inch, Action Figure for Boys and Girls Ages 8 and Up",https://m.media-amazon.com/images/I/713bG-N3BiL._AC_UL320_.jpg,24.99,4.7,False,200,Toys & Games
B07CNDG65B,Snap Circuits BRIC: Structures | Brick & Electronics Exploration Kit | Over 20 Stem & Brick Projects | Full Color Project Manual | 20 Parts | 75 BRIC-2-Snap Adapters | 140+ BRICs,https://m.media-amazon.com/images/I/81xrYXEQppL._AC_UL320_.jpg,35.99,4.7,False,400,Toys & Games
B09BFWX4W9,Sweet Counting Large Montessori Toy Wooden Sorter Game 60 Balls 25 mm Age 1+ Color Sorting and Counting Preschool Learning Education,https://m.media-amazon.com/images/I/71M4VaSvhZL._AC_UL320_.jpg,32.9,4.6,False,0,Toys & Games
B071163DXX,"Magnetic Slime Putty, Magnetic Space Putty Slime with Upgraded Magnet Toys, Fidget Toy Stress Reliever Puddy for Kids Adults Toys for Christmas Birthday Gifts Stocking Stuffers (1 Pack, Silver)",https://m.media-amazon.com/images/I/71oU1pX1thL._AC_UL320_.jpg,12.99,4.0,False,0,Toys & Games
B00RZTJJLA,"Step2 Cascading Cove with Umbrella, Kids Sand and Water Activity Sensory Table, 6 Piece Accessory Kit, Toddler Summer Outdoor Toys, 2 – 10 Years Old",https://m.media-amazon.com/images/I/81SZ0ae9m9L._AC_UL320_.jpg,87.81,4.8,False,200,Toys & Games
B087CBCDDS,AQUARIUS Peanuts Snoopy in Space Puzzle (500 Piece Jigsaw Puzzle) - Officially Licensed Peanuts Merchandise & Collectibles - Glare Free - Precision Fit - 14 x 19 Inches,https://m.media-amazon.com/images/I/81HM6K2HxJL._AC_UL320_.jpg,16.18,4.8,False,0,Toys & Games
B082QS5BCQ,"hand2mind Head to Toe Human Body Science Kit, Slime Kit, STEM Kit for Kids, Includes Kids Stethoscope That Works, Human Body Learning, Human Anatomy for Kids, Kids Doctor Kit, Homeschool Supplies",https://m.media-amazon.com/images/I/617qBklcCCL._AC_UL320_.jpg,33.74,4.1,False,0,Toys & Games
B0B1MV6W2P,"Toddler Toys for 2 3 4 5 Year Old Boys and Girls, Talking Flash Cards Pocket Speech for Toddlers, Autism Sensory Toys for Autistic Children, Educational Learning Montessori Speech Therapy Toys",https://m.media-amazon.com/images/I/71AhkNNkBjL._AC_UL320_.jpg,9.99,4.1,False,0,Toys & Games
B0BQ2HK29F,"Brain Teaser Puzzles for Adults and Kids Ages 8-12, Creative 3D Puzzle Set Educational Toys for Family Game Night, Unlock Toys IQ Mind Logic Test, Thinking Games (4PCS Set A)",https://m.media-amazon.com/images/I/71vc-l3T13L._AC_UL320_.jpg,39.99,4.5,False,0,Toys & Games
B0BLJ2S9MC,"LEGO Marvel Baby Rocket’s Ship 76254 from Guardians of the Galaxy 3 Featuring Rocket Raccoon Minifigures, Collectible Super Hero Buildable Spaceship Toy Gift for Kids Ages 8 and up",https://m.media-amazon.com/images/I/81oWMC48HVL._AC_UL320_.jpg,34.49,4.9,False,500,Toys & Games
B08B13WS3S,"iPlay, iLearn Airplane Doll House Playset, Girls Dollhouse Pretend Play Set, Toddler Pink Dream Jet Plane Toy Accessory W/ 5 Mini People Furniture, Imaginative Birthday Gifts for 3 4 5 6 Year Old Kid",https://m.media-amazon.com/images/I/713k2QeZ7OL._AC_UL320_.jpg,34.97,4.3,False,0,Toys & Games
B078Y3GBN4,HABA Dragon's Breath - 2018 Kinderspiel des Jahres (Children's Game of The Year) Winner - an Exciting Collecting Game for 2-4 Players Ages 5+,https://m.media-amazon.com/images/I/81LELu9846L._AC_UL320_.jpg,24.99,4.7,False,200,Toys & Games
B00TGOKAT2,GoSports Slammo Official Replacement Balls 3-Pack - Works for All Roundnet Game Sets - Choose Between Competition Size or XL Size Balls,https://m.media-amazon.com/images/I/71k21U1lbcL._AC_UL320_.jpg,14.99,4.7,False,200,Sports & Outdoor Play Toys
B08PMJTQM4,"Rocket Copters Slingshot LED Light Up Helicopters, 6 Copters and 3 Launchers - As Seen on TV for Unisex Children",https://m.media-amazon.com/images/I/71JCTCT6C9L._AC_UL320_.jpg,0.0,4.6,False,0,Sports & Outdoor Play Toys
B0C375PWNJ,Gel Ball Blaster 2 Pack Electric Powered Toys with Water Beads 80k PCS for Team Game for Kids Boys Girls Adults Age 12+ Play Outdoor Indoor,https://m.media-amazon.com/images/I/81OiWLOjLoL._AC_UL320_.jpg,39.95,5.0,False,0,Sports & Outdoor Play Toys
B0BKJZBWLH,"Laviesto Game Replacement Balls,0.91Inch(23mm) Acrylic Solid Color Marbles Balls for Chinese Checkers,Aggravation Game,Marble Games,Wahoo,Dirty Marbles,Board Game DIY Craft Home Decoration (42PCS)",https://m.media-amazon.com/images/I/61AKY0F2cAL._AC_UL320_.jpg,13.99,5.0,False,0,Sports & Outdoor Play Toys
B08CVDVYS8,"EISENSP 8pcs Ground Rustproof Heavy Rebar Trampoline Wind Stakes Safety Ground Anchor - 9 inch Curved Steel Stakes with Chisel Point end, Green Antirust Coated",https://m.media-amazon.com/images/I/715x3TOYsQL._AC_UL320_.jpg,16.99,4.6,False,0,Sports & Outdoor Play Toys
B07TJL5RJ3,"Top Race Giant Inflatable Beach Balls 42 Inch Large Pool Ball | Beach Summer Parties, and Gifts, Pool Balls for Swimming Pools | 2 Pack Blow Up Rainbow Color Beach Balls (2 Balls)",https://m.media-amazon.com/images/I/51AZFBlpz+L._AC_UL320_.jpg,24.99,4.4,False,500,Sports & Outdoor Play Toys
B0C231SM4W,"Beach Toys for Kids 3-8-10-12, Beach Shell Collecting Bag, Shells Filter Beach Shovel and Shells Cleaning Brush, Travel Beach Toys",https://m.media-amazon.com/images/I/81mkaDe+65L._AC_UL320_.jpg,5.99,3.8,False,50,Sports & Outdoor Play Toys
B07Y5687V5,YagoDago Refill Darts Universal Suction Dart Foam Bullet 100-Dart Refill Pack for Nerf N-Strike Elite Series Blasters Toy Gun,https://m.media-amazon.com/images/I/71L0yBjSR8L._AC_UL320_.jpg,11.99,4.6,False,200,Sports & Outdoor Play Toys
B0C99PZXJ1,lpvoqpth 64 PCS Glow Flying Toys Sets(32 Slingshot+32 LED copters) Birthday Gifts Party Favors Glow in The Dark Party Supplies Summer Outdoor Game for Kids,https://m.media-amazon.com/images/I/61BSH9YjT-L._AC_UL320_.jpg,12.99,5.0,False,300,Sports & Outdoor Play Toys
B0C7R6GTK6,"48 Pcs Halloween Bubble Wands Mini Pumkin Bubble Toys Bulk for Kids Halloween Party Favor,Outdoor Indoor Activity Use, (Halloween)",https://m.media-amazon.com/images/I/7152f7FZjSL._AC_UL320_.jpg,11.99,4.6,False,700,Sports & Outdoor Play Toys
B0BLCWMCW6,"Bubble House Inflatable Bubble Tent, Commercial Grade PVC Bubble House with Blower&Pump Kids Party Clear Dome Balloon Garden Tent, 10FT Dia Bubble, 6FT Tunnel",https://m.media-amazon.com/images/I/81rW9ZOusdL._AC_UL320_.jpg,1288.0,4.5,False,50,Sports & Outdoor Play Toys
B00BGYRIU4,"Socker Boppers Sumo Bumper Boppers Belly Bumper Toy, One Bopper and repair patch, Kids get active and silly, Air inflated fun, More fun than a pillow fight, Great for agility-balance-coordination",https://m.media-amazon.com/images/I/917pCTKEQgL._AC_UL320_.jpg,14.99,4.1,False,50,Sports & Outdoor Play Toys
B09T2QKS13,"FLAMDYNO Pool Toys - 4 Pack Light Up Beach Balls for Kids w/ 8 Light Modes, Pool Beach Games Balls for Outdoor or Indoor Activities, Glow in The Dark Pool Beach Decorations for Kids and Adults",https://m.media-amazon.com/images/I/71yrSUa95NL._AC_UL320_.jpg,27.99,4.0,False,1000,Sports & Outdoor Play Toys
B0166RYX4O,Skywalker Trampolines Round Enclosure Net,https://m.media-amazon.com/images/I/81Htjh18P0L._AC_UL320_.jpg,59.65,4.7,False,100,Sports & Outdoor Play Toys
B0C782QQ9L,"Toddler Golf Set, Upgraded Kids Golf Clubs with Golf Board, Putting Mat, 8 Balls, 4 Golf Clubs and Golf Cart, Indoor and Outdoor Sports Toys Birthday Gifts for Girls Aged 2 3 4 5 Year Old (Pink)",https://m.media-amazon.com/images/I/71aJG-fMZvL._AC_UL320_.jpg,29.99,4.0,False,400,Sports & Outdoor Play Toys
B07T9L1G46,"OBTANIM 30 Pcs Glass Marbles Toy 1 Inch Mega Beautiful Cats Eyes Marbles Bulk for Children, Marble Games, Multicolor",https://m.media-amazon.com/images/I/717lXxfNIgL._AC_UL320_.jpg,12.99,4.4,False,50,Sports & Outdoor Play Toys
B01CCVVSRI,"Dadoudou Kids Ball Pit Balls, 100pcs Colorful Fun Phthalate Free BPA Free Crush Proof Balls Soft Plastic Air-Filled Ocean Ball Playballs for Baby Kids Tent Swim Toys Ball",https://m.media-amazon.com/images/I/61d2xCAwmpL._AC_UL320_.jpg,16.89,4.3,False,50,Sports & Outdoor Play Toys
B07RSNQ7GJ,"Sand Pal Beach Toys Sand Castle Kit - 9 Pieces Travel-Friendly Beach Toy Set, Snow Toys for Kids 3-10 - Outdoor & Indoor Play Sandbox Toys - Sand Castle Building Molds & Tools for Adults with Mesh Bag",https://m.media-amazon.com/images/I/81SNR2V8BWL._AC_UL320_.jpg,39.9,4.2,False,200,Sports & Outdoor Play Toys
B07L4X62CK,"JX Rocket Slingshot Flying Toys with Led Lights,12Pcs LED Arrow Helicopters + 12Pcs Launchers,Summer Outdoor Game LED Slingshot Toy for Kids, Glow in The Dark Kids Party Supplies",https://m.media-amazon.com/images/I/81r-Iqo67xL._AC_UL320_.jpg,13.98,4.2,False,300,Sports & Outdoor Play Toys
B09NX7Y2X8,"XShot Skins Dread Foam Dart Blaster - Camo, 24 Darts by ZURU",https://m.media-amazon.com/images/I/811qTa+JyyL._AC_UL320_.jpg,12.99,4.8,False,50,Sports & Outdoor Play Toys
B09JKP2MK5,"30 Pieces Mini Colorful Cornhole Bean Bags Nylon Bean Bags Sack Tossing Beanbags Fun Sports Outdoor Family Games Kid Toys for Hand Toss Games Party Game Supply for Boy Girl (2.4 x 2.4 Inch, Circle)",https://m.media-amazon.com/images/I/81vTDGMkb0L._AC_UL320_.jpg,19.99,3.6,False,0,Sports & Outdoor Play Toys
B00P2WG7G2,"WALIKI Hopper Ball for Kids | Hippity Hop Ball | Jumping Hopping Ball | Therapy Ball | Green (Ages: 7-9 (20""/50CM))",https://m.media-amazon.com/images/I/51QdCHpCosL._AC_UL320_.jpg,16.99,4.6,False,50,Sports & Outdoor Play Toys
B09QJZ21TX,"Podzly 12 Pack Beach Pails Sand Buckets - 7"" Large Beach Pails with Handles for Kids - Colorful Beach Toys for Sand Molds & Castles - Great Sand Buckets - Fun and Learning Accessory for Kids!",https://m.media-amazon.com/images/I/41aAONSL-3L._AC_UL320_.jpg,44.85,4.3,False,0,Sports & Outdoor Play Toys
B0BHQSCG1J,"Meland Basketball Hoop Indoor - Mini Basketball Hoop for Door with Electronic Scoreboard, 4 Balls & Air Pump, Basketball Gifts for 5,6,7,8,9,10,11,12 Year Old Boys Toys Teen Kids (Electronic)",https://m.media-amazon.com/images/I/71tw1PWl7KL._AC_UL320_.jpg,28.79,4.6,False,300,Sports & Outdoor Play Toys
B098DPNMP6,Baseball Toss Games with 6 Baseball Bean for Indoor and Outdoor Bean Bag Toss Game Throw Game School Activity Sport Theme Party Decorations Supplies,https://m.media-amazon.com/images/I/81cgYOsDY+S._AC_UL320_.jpg,14.99,4.1,False,0,Sports & Outdoor Play Toys
B00BXVHZ7Q,Swimline Beach Balls for Kids Toddlers and Adults Up to 24 36 Inch Large Sizes Easy Fun Design Classic Rainbow Emoji for Pool Beach Lake Volleyball Inflatable Toys Outdoor Games Summer Water Party,https://m.media-amazon.com/images/I/71+yQUGOR4L._AC_UL320_.jpg,10.77,4.0,False,100,Sports & Outdoor Play Toys
B00J0X2BKK,Hog Wild Holiday Snowman Popper Toy - Shoot Foam Balls Up to 20ft for Kids,https://m.media-amazon.com/images/I/71xOYTOAMiL._AC_UL320_.jpg,13.6,4.4,False,0,Sports & Outdoor Play Toys
B082VSK15P,"6.6 Ft Climbing Rope Ladder for Kids, Climbing Ladder Hanging Rope Ladder for Indoor Play Set and Outdoor Tree House, Playground Swing Set and Ninja Slackline",https://m.media-amazon.com/images/I/71izizw-46L._AC_UL320_.jpg,23.79,4.6,False,100,Sports & Outdoor Play Toys
B0C1BY2QC5,"2 in 1 Toddler Swing ＆ Jumper, Swing Set for Indoor/Outdoor, Baby Jumpers and Bouncers, Easy to Assemble & Store, Suitable for Aged 6 Months to 10 Years Old",https://m.media-amazon.com/images/I/71WvsKXZ23L._AC_UL320_.jpg,108.99,3.8,False,50,Sports & Outdoor Play Toys
B0B1VMJV78,LUOMAJA Professional Unresponsive Yoyo Ball - Miraculous Metal Yo Yo Magic for Kids Beginner with 10 String Pack + 2 Dragon Finger Gloves for Beginner & Professional (JD306),https://m.media-amazon.com/images/I/7112ymb93JL._AC_UL320_.jpg,13.99,3.6,False,100,Sports & Outdoor Play Toys
B0B9B7NN6F,"YDDS Glow in The Dark Replacement Tether Ball with Carabiner, Ball Pump with Needle for Kids and Adults Backyard Game",https://m.media-amazon.com/images/I/71N3WeuXwcL._AC_UL320_.jpg,16.99,3.7,False,400,Sports & Outdoor Play Toys
B09H4DGVVM,"Mr. Pen- Inflatable Baby Swim Float, for Ages 6-30 Months, Blue, Waist Ring Inflatable Baby Pool Float, Infant Swim Float, Baby Pool Toys, Infant Floats for Pool, Baby Swimming Float",https://m.media-amazon.com/images/I/81BLwCzym9L._AC_UL320_.jpg,9.99,4.2,False,100,Sports & Outdoor Play Toys
B0BVPR9P3N,Junkin 24 Pcs Rainbow Hand Kite Waldorf Toys Creative Dancing Ribbon Streamer with Wood Ring Runner Wrist Sensory Toys Learning Educational Toy for Playroom Dancing Birthday Party Gift (Rainbow),https://m.media-amazon.com/images/I/81jTL4NdBdL._AC_UL320_.jpg,29.99,4.2,False,50,Sports & Outdoor Play Toys
B098R6YRDT,"LUPPLE Girl Toys Gun for Nerf Gun Bullet, Pink Automatic Foam Blaster Gun Outdoor Shooting Game, Party Birthday Gifts for Little Girls 6 7 8+ Year Old",https://m.media-amazon.com/images/I/7102r0KPhJL._AC_UL320_.jpg,23.99,4.5,False,50,Sports & Outdoor Play Toys
B0B4BQSJKQ,Hot Wheels Ford Focus RS,https://m.media-amazon.com/images/I/71Cy2RjInPL._AC_UL320_.jpg,6.67,4.5,False,0,Sports & Outdoor Play Toys
B0C5T1NXZ1,"LOFIR Play Tent with Mat and Lights, Kids Tent Indoor | Kids Playhouse Outdoor, Kids Play Tent with Windows, 52"" x35"" x 53"", Large Toddler Tent for Kids Aged 3+, Kids Room Furniture",https://m.media-amazon.com/images/I/81-YZemtAQL._AC_UL320_.jpg,49.99,4.0,False,50,Sports & Outdoor Play Toys
B08ZL7JV3W,SKIP NN' HOLE Pool Game | Skipping Stone Swimming Pool Cornhole Game for Pool or Lake | Skipping Stone Pool Cornhole Game with Floating Targets | Perfect Pool Toys for Kids Ages 8-12 and Adults,https://m.media-amazon.com/images/I/81HNlJhwAGL._AC_UL320_.jpg,99.99,4.5,False,50,Sports & Outdoor Play Toys
B0BPM2649N,Chuangdi 16 Pcs Flick Football Games for Kids Mini Table Top Sports Games with Posts and Plastic Footballs Indoor Finger Games for Kids Football Party Favors Birthday Gifts,https://m.media-amazon.com/images/I/71ZX4Qci-gL._AC_UL320_.jpg,20.99,3.9,False,50,Sports & Outdoor Play Toys
B0B6JM2FCG,"WeGlow Light Up Bubble Wands | LED Bubble Blowers, Continuous Bubble Stream, and Non-Toxic Bubble Solution | Perfect for Kids of All Ages | Great for Outdoor Play and Sensory Exploration! - Light Red",https://m.media-amazon.com/images/I/511a3iBTklL._AC_UL320_.jpg,22.99,3.9,False,0,Sports & Outdoor Play Toys
B07S9GRV39,"Green Vivid Inflatable Drink Holder 12 Pack,Pool Drink Holder Floats for Parties and Kids Water Fun Toys,Drink Floats for Pool[Newest Type Mermaid&Whale]",https://m.media-amazon.com/images/I/71fPRJO69fL._AC_UL320_.jpg,9.99,4.6,False,300,Sports & Outdoor Play Toys
B07BFPTKG5,PicassoTiles Soccer Hoverball Air Hockey Electric Power Airlifted Hover Ball Indoor Floating Airflow Hovering LED Light and Soft Bumper Battery Powered Training and Playing Age 3 and up PTH100,https://m.media-amazon.com/images/I/61IdN9ZNaJL._AC_UL320_.jpg,11.99,4.2,False,50,Sports & Outdoor Play Toys
B07SDBG7WV,NUOBESTY 12pcs Party pinwheels Wind Spinner Kids Toy Garden Lawn Party Decor (Random Color),https://m.media-amazon.com/images/I/61NFUJP6n8L._AC_UL320_.jpg,9.99,2.3,False,0,Sports & Outdoor Play Toys
B09DQ9MQTM,KidzAdventure 2 in 1 Kids Play Tent for Camping | 1 – 2 Person Backpacking Tent | Ultralight Indoor & Outdoors Tents – Adventure Theme,https://m.media-amazon.com/images/I/71Dc4ph1YLL._AC_UL320_.jpg,29.99,4.3,False,100,Sports & Outdoor Play Toys
B09HZBKJZV,"TOY Life Beach Sand Toys for Kids Toddlers - Shark Beach Toys for Kids 3-10, Toddler Sandbox Toy with Sand Bucket, Beach Shovels, Animal Molds Sand Castle Toys, Mesh Bag, Sand Toy for Toddler Boy Girl",https://m.media-amazon.com/images/I/81iJeicU9XL._AC_UL320_.jpg,16.97,4.2,False,100,Sports & Outdoor Play Toys
B071YDQ3PH,"NERF Longarm Doomlands Toy Blaster with Flip-Open Drum and 5 Official Nerf Doomlands Elite Darts for Kids, Teens, and Adults",https://m.media-amazon.com/images/I/710r4sc4h5L._AC_UL320_.jpg,28.99,4.6,False,0,Sports & Outdoor Play Toys
B08ZHH2C9H,"Multi-Purpose Toy Revolver Guns， Soft Bullet Toy Blaster Revolver Guns for Boys， Water Guns Toy for Boys ，with 10 Soft Foam Darts for Kids， Teens, Adults",https://m.media-amazon.com/images/I/51V2J3mrwzL._AC_UL320_.jpg,9.99,4.0,False,0,Sports & Outdoor Play Toys
B0BTMVTCQL,"Hot Wheels '80 El Camino, HW The '80S",https://m.media-amazon.com/images/I/81itiThf8FL._AC_UL320_.jpg,6.93,4.4,False,50,Sports & Outdoor Play Toys
B0BZXHPT8C,"Hot Wheels Lotus Emira, Factory Fresh 3/5",https://m.media-amazon.com/images/I/71XsRUAH6kL._AC_UL320_.jpg,5.8,4.6,False,0,Sports & Outdoor Play Toys
B09P2QK4PG,"Sloosh 3 Pack 4-in-1 Inflatable Pool Floats Hammock, Water Hammock Lounges, Multi-Purpose Swimming Pool Accessories (Saddle, Lounge Chair, Hammock, Drifter) for Pool, Lake, Outdoor, Beach",https://m.media-amazon.com/images/I/71jfqV4Z5fL._AC_UL320_.jpg,37.99,4.6,False,0,Sports & Outdoor Play Toys
B08XY22PVZ,"Weighted Smart Hoola Hoop, Smart 24 Sections Detachable Hoola Hoop, Suitable for Adults and Children",https://m.media-amazon.com/images/I/71HSKVSVkjL._AC_UL320_.jpg,27.99,4.0,False,0,Sports & Outdoor Play Toys
B0B2966VNT,"HAHASOLE Large Play Tent with Lights, Kids Tent Large Toddler Playhouse Indoor Outdoor, Princess Castle Tent with Windows, Kids Play Tent for Boys Girls, Great Gift",https://m.media-amazon.com/images/I/71b7UlaFANL._AC_UL320_.jpg,39.99,4.0,False,0,Sports & Outdoor Play Toys
B08XJZBG3C,"2 Pieces Sand Wipe Off Mitt Beach Sand Cleaner Soft and Skin Friendly Towel Help Parents Clean Sand from Children's Skin Mitt Pack for Surf, Ocean and Lakeside Recreation",https://m.media-amazon.com/images/I/81SSv1c5SFS._AC_UL320_.jpg,11.99,4.3,False,0,Sports & Outdoor Play Toys
B0C68KCKYH,Electric Gel Ball Blaster with Drum - JM-X2 Automatic and Manual Gel Ball Blaster Pistol with 30000 Water Balls Shooting Toy for Kids and Adults Ages 12+,https://m.media-amazon.com/images/I/81xKPLVhGNL._AC_UL320_.jpg,24.99,4.4,False,50,Sports & Outdoor Play Toys
B0BW83TD8Q,"Inflatable Swan Pool Float with Colorful Lights, FlyfreeU Solar Powered LED Color Changing Swan Swim Tube Rings, 42'' Large Pool Beach Floaties Lake and Beach Floaty Summer Pool Raft Lounge for Adults",https://m.media-amazon.com/images/I/718CqHrM6vL._AC_UL320_.jpg,19.99,4.6,False,900,Sports & Outdoor Play Toys
B0BB4C7WV6,"Inflatable Beer Cooler 22"" Mug Inflatable Cooler for Parties, for Themed Party Decorations, Outdoor Party Supplies Inflatable Floating Drink Bucket, BBQ Picnic Pool Party Oktoberfest Buffet Cooler",https://m.media-amazon.com/images/I/71h6lhSw8fL._AC_UL320_.jpg,12.99,4.2,False,0,Sports & Outdoor Play Toys
B09WQX5B5D,"Swing Hangers for Wooden Sets Pack of 4 Heavy Duty Swingset Hardware with Locking Hooks for Porch, Patio, Playground Indoor/Outdoor by Highpro",https://m.media-amazon.com/images/I/71RU5YUZAeL._AC_UL320_.jpg,28.86,4.7,False,400,Sports & Outdoor Play Toys
B0BR5F1NZK,Water Guns Electric Automatic Water Guns Spray Water Gun 2 in 1 - Electric Water Squirt Soaker Guns Summer Swimming Pool Beach Water Fighting Play Toys for Boys Girls Children,https://m.media-amazon.com/images/I/71vtiQBku2L._AC_UL320_.jpg,11.99,4.3,False,0,Sports & Outdoor Play Toys
B07C2NC31C,"CoTa Global Inflatable Pool Float Tube Confetti Premium Swim Ring Heavy Duty Vinyl Flotation Pool Floats Toy for The Beach, Party, Vacation, UV Resistant - Pool Party",https://m.media-amazon.com/images/I/71U9pvNNzjL._AC_UL320_.jpg,14.47,4.5,False,50,Sports & Outdoor Play Toys
B07N1BT6W7,"Kids Tactical Vest Kit for Nerf Guns Tactical Jacket Kit for N-Strike Elite Series with 50 Refill Darts Bullets, Reload Clips, Wrist Band, Protective Glasses and Face Tube Mask for Girls Boys",https://m.media-amazon.com/images/I/71OCzqWp8iS._AC_UL320_.jpg,13.99,4.4,False,0,Sports & Outdoor Play Toys
B07Q256563,"Prextex 600 Easy Fill Water Balloons - Bulk Balloon Pack for Water Sports Fun, Splash Fights for Swimming Pool Backyard Toy and Outdoors, Summer Outdoor Water Game and Party Favors",https://m.media-amazon.com/images/I/817kG5AGjGL._AC_UL320_.jpg,5.49,4.1,False,0,Sports & Outdoor Play Toys
B099LPF1JL,"The Dreidel Company Beach Day Playsets (Pack of 4) 4.25"" Sand Bucket Play Set Box Includes, 1 Pail, 1 Shovel Toy for Boys and Girls Birthday Party Favor",https://m.media-amazon.com/images/I/51mzrIRku1S._AC_UL320_.jpg,8.99,4.3,False,200,Sports & Outdoor Play Toys
B086V4B15W,"JOYIN 53'' Inflatable Sprinkler with Unicorn Design- Sprinkler for Kids and Adults Outdoor Water Toys, Alicorn/Pegasus Lawn Sprinkler Birthday Party Decorations Gift for Kids Summer Fun Activities",https://m.media-amazon.com/images/I/71BYGRRQIIS._AC_UL320_.jpg,12.99,4.2,False,0,Sports & Outdoor Play Toys
B0C22YJFKD,"FirstE Inflatable Rainbow Cloud Pool Drink Holder with Solar Lights,Floating Pool Cup Holders for Hot Tub, LED Light Glow in Dark Pool Drink Floats, Floating Cooler Bar Accessory for Pool Water Fun",https://m.media-amazon.com/images/I/61m1eZ5dRoL._AC_UL320_.jpg,29.99,4.4,False,0,Sports & Outdoor Play Toys
B0002GTHZQ,Spielstabil Sturdy Children's Leaf Rake (Made in Germany) 2.5 and up,https://m.media-amazon.com/images/I/616YuoZSreL._AC_UL320_.jpg,24.99,4.6,False,50,Sports & Outdoor Play Toys
B09X9VZDDZ,"Hooch Hog Floating Cup Holder, Can Holder & Beer Holder - A Pool Drink Float That Won't Tip Over & is a Pool Must Haves 2023",https://m.media-amazon.com/images/I/71K5EgOjoWL._AC_UL320_.jpg,22.99,4.8,False,0,Sports & Outdoor Play Toys
B0BP62G1D7,"Bubble Machine, Bubble Machine for Kids Toddlers, Make Extra Large Bubbles (10 Times Larger) & Bubbles Inside Bubble, 1000+ Bubbles Per Minute, Bubbles Toys for Kids Indoor Outdoor Birthday Party",https://m.media-amazon.com/images/I/81XZnCPxoRL._AC_UL320_.jpg,25.99,4.2,False,900,Sports & Outdoor Play Toys
B00W2RJ7KI,"OgoDisk XS Disc Set with 2 OgoSoft Balls - 12 Inch Bouncy Disk Toy for Outdoors, Lawn & Pool - Throw, Toss & Catch Game - Kids & Adults 8+",https://m.media-amazon.com/images/I/81hugLhwKyL._AC_UL320_.jpg,27.99,4.5,False,0,Sports & Outdoor Play Toys
B0B4DNQXSH,"10 Pcs Bouncy Balls with Handles for Kids Bulk, Hopper Ball Hippity Hop Bouncing Balls with Cartoon Animal, 18 Inch Jumping Exercise Hopping Ball for Jumping Sitting Racing, Pump Included (Cartoon)",https://m.media-amazon.com/images/I/7185qLqm9nL._AC_UL320_.jpg,39.99,4.7,False,50,Sports & Outdoor Play Toys
B09F66CSKD,"Toy Lever Shotgun Lever Type Toy,Air Pump Shotgun Play Set Shell Ejecting,Parent-Child Game Outdoor Game with Goggles Two Kinds of Bullets",https://m.media-amazon.com/images/I/51g2IA+uo4L._AC_UL320_.jpg,99.0,4.4,False,0,Sports & Outdoor Play Toys
B09Z212GJR,BYUQDF Electric Gel Ball Blaster M416-5 Splatter Ball Blaster Automatic with 20000 Water Beads Splat Ball Toys for Outdoor Game for Boys and Girls Ages 12+,https://m.media-amazon.com/images/I/71PFp1nZmEL._AC_UL320_.jpg,13.99,3.8,False,50,Sports & Outdoor Play Toys
B0C5DFGDWW,16 Pcs 9 Inch Hanging Inflatable Football Decor Football Birthday Party Decoration Inflatable Rugby Ball Party Favors Supplies Beach Pool Football Toys,https://m.media-amazon.com/images/I/81C9UCrsSML._AC_UL320_.jpg,23.99,3.9,False,50,Sports & Outdoor Play Toys
