asin,title,imgUrl,price,stars,isBestSeller,boughtInLastMonth,category_name
B09WZSYJXF,GPC Image Compatible Ink Cartridge Replacement for HP 564XL 564 XL Compatible with DeskJet 3520 3522 Officejet 4620 Photosmart 5520 6510 7520 7525 Printer (4 Photo Black),https://m.media-amazon.com/images/I/81PfuPdW99L._AC_UL320_.jpg,15.99,3.8,False,50,Office Electronics
B079X28FDK,"Canon PFI-310 330ml Matte Black Pigment Ink Tank for imagePROGRAF TX-2000, TX-3000 and TX-4000 Printers",https://m.media-amazon.com/images/I/61PCnbtK3cL._AC_UL320_.jpg,149.0,4.4,False,0,Office Electronics
B07HPFG5ZN,Canon GPR-58 Toner Cartridge - Yellow,https://m.media-amazon.com/images/I/31SBhiKpHTL._AC_UL320_.jpg,113.29,5.0,False,0,Office Electronics
B09V4CGC45,Compatible Toner Cartridge 057H ( 057 ) 2 Blacks High Capacity 10000 Pages for Canon LBP236dw MF445dw LBP226dw MF455dw MF449dw MF448dw MF443dw LBP228dw LBP227dw LBP223dw MF451dw MF452dw Printer,https://m.media-amazon.com/images/I/71uxw5dWC3L._AC_UL320_.jpg,43.8,3.0,False,50,Office Electronics
B0BTWNVMYL,5 Pack Phone Cord Landline8Ft Uncoiled / 1.4Ft Coiled Landline Phone Handset Cable RJ9 4P4C Telephone Accessory- Black,https://m.media-amazon.com/images/I/71HGqzy50PL._AC_UL320_.jpg,9.99,4.7,False,0,Office Electronics
B09YC21GTT,AMERICAN MAILING SOLUTIONS INC. PB SL-870-1 | Red Fluorescent Ink Cartridge Replacement for The PB SendPro Mailstation Series Postage Meter (CSD1) Machine…,https://m.media-amazon.com/images/I/814MVDzK2EL._AC_UL320_.jpg,55.99,4.0,False,100,Office Electronics
B0C4FKZPDG,Butory 1D 2D QR Barcode Scanner: Hands Free Automatic Bar Code Scaner Omnidirectional Scanning UPC Reader USB Wired Escaner Lector for Industrial Library Retail Inventory POS,https://m.media-amazon.com/images/I/61HiE71kXWL._AC_UL320_.jpg,59.99,4.7,False,50,Office Electronics
B0007Q3QSK,"Panasonic KX-TSC11B Corded Phone with Caller ID, Black",https://m.media-amazon.com/images/I/71QWeplR5NL._AC_UL320_.jpg,27.03,4.0,False,100,Office Electronics
B0B87RGZNP,"Auto-Cut Label Maker Machine with Tape PS-100E Rechargeable Label Printer with Keyboard, Multiple Templates for TZe 0.13~0.47 Inch Tapes for Home Office Industrial Labeling Organization",https://m.media-amazon.com/images/I/71QKBRxhHmL._AC_UL320_.jpg,79.99,4.3,False,100,Office Electronics
B07WVF56VB,"imageCLASS MF445dw - All-in-One, Wireless, Mobile-Ready Laser Printer with 3 Year Warranty",https://m.media-amazon.com/images/I/5179sYbzUaL._AC_UL320_.jpg,399.0,4.3,False,0,Office Electronics
B094C5F8SY,"GBC 300M Paper Shredder, Auto Feed+, 300 Sheet Capacity, Micro-Cut, Office Shredding (WSM1757609)",https://m.media-amazon.com/images/I/51gJftNHmbL._AC_UL320_.jpg,798.23,3.7,False,0,Office Electronics
B00BR3KOM8,"Lexmark 52d1h0e High-Yield Toner, 25,000 Page-Yield, Black",https://m.media-amazon.com/images/I/61w0xZud78L._AC_UL320_.jpg,267.91,3.0,False,0,Office Electronics
B000XVLZNC,"HP 36A Black Toner Cartridge Works with HP LaserJet M1120 MFP Series, HP LaserJet M1522 MFP Series, HP LaserJet P1505 Series CB436A",https://m.media-amazon.com/images/I/61+7H5aBI5L._AC_UL320_.jpg,0.0,4.6,False,100,Office Electronics
B00JKAJ9W6,"NORWII N27 PowerPoint Clicker with Laser Pointer & 330FT Wireless Range, 2.4GHz Hyperlink Volume Wireless Presenter Remote Presenation Clicker for Laptop Computer Project Geogle Slide",https://m.media-amazon.com/images/I/51Jedo6b7GL._AC_UL320_.jpg,12.99,4.4,False,50,Office Electronics
B07D9CLDFW,"Aztech Compatible Toner Cartridge Replacement for HP 26X CF226X 26A CF226A Laserjet Pro M402n M402dw M402dn Laserjet Pro MFP M426fdw M426fdn M426dw (Black, 4-Pack)",https://m.media-amazon.com/images/I/714vulEO9zL._AC_UL320_.jpg,83.49,4.6,False,300,Office Electronics
B08W33VJY3,"E-Z Ink (TM Compatible Ink Cartridge Replacement for HP 932XL 933XL 932 933 to use with Officejet 6100 6600 6700 7110 7510 7610 7612 Printer (1 Black, 1 Cyan, 1 Magenta,1 Yellow) 4 Pack",https://m.media-amazon.com/images/I/710Il+AomgL._AC_UL320_.jpg,23.99,4.0,False,300,Office Electronics
B0B6TL35XP,NEXTPAGE CLI42 Black Ink Cartridges Replacement for Canon CLI 42 CLI-42 Work for Canon Pixma Pro 100 Pro-100S Printer (CLI42BK 4 Pack),https://m.media-amazon.com/images/I/61lg46rRRxL._AC_UL320_.jpg,14.59,4.3,False,0,Office Electronics
B073119ZSJ,"Portable Document Scanner, AOZBZ 900DPI Handheld Image Scanner, Scanning Wand,A4 Colour Photo Mobile Scanner Handy Scan (JPG/PDF Format, High Speed USB 2.0, Micro Need SD/TF Card But Not Included)",https://m.media-amazon.com/images/I/51YjJd-pmEL._AC_UL320_.jpg,49.99,3.8,False,50,Office Electronics
B07ZZV9Z8C,"Dahle ShredMATIC SM 300 Auto-Feed Paper Shredder, 300 Sheet Locking bin, Oil-Free, Jam Protection, Security Level P-4, 3-5 Users",https://m.media-amazon.com/images/I/71NksGKFpuL._AC_UL320_.jpg,579.0,4.2,False,50,Office Electronics
B0BTM8TZ6G,"XJI 63XL Remanufactured Ink Cartridges Replacement for HP Ink 63 XL Black and Tri-Color Combo Pack, for OfficeJet 3830 3833 5255 5258 5260 Envy 4510 4520 4650 DeskJet 1112 2132 3630 3634 3639 Printer",https://m.media-amazon.com/images/I/71gfQ47dEZL._AC_UL320_.jpg,22.36,4.4,False,1000,Office Electronics
B000E168FQ,"Xyron Permanent Adhesive Refill for the Creative Station & Creative Statio Lite, 5"" x 18', Refill Cartridge for Label Maker, Laminator Machine, Home Office & Home School Craft Supplies (AT1605-18)",https://m.media-amazon.com/images/I/711brHWuM3L._AC_UL320_.jpg,16.9,4.6,False,300,Office Electronics
B0CGLZR1GV,"952XL High-Yield Ink Cartridges (5-Pack, 2Black/1Cyan/1Magenta/1Yellow) - LOMENTI Compatible Ink Replacement for HP OfficeJet Pro 7740 8210 8216 8218 8710 8715 8716 8717 8719 8720 8725 Printer",https://m.media-amazon.com/images/I/713UCINhU0L._AC_UL320_.jpg,107.89,4.5,False,100,Office Electronics
B00MXCVLGA,"LD Products Remanufactured Ink Cartridge Replacement for Epson 676XL T676XL High Yield (Black, Cyan, Magenta, Yellow, 4-Pack) Workforce WP-4020 WP-4530 WP-4540 WP-4010 WP-4023 WP-4090 WP-4520 WP-4533",https://m.media-amazon.com/images/I/71gz7gDs1yS._AC_UL320_.jpg,28.99,3.8,False,100,Office Electronics
B07G9T12RW,"CYTTR Thermal Transfer Ribbon - Premium Wax Printer Ribbon 1""Core Ink Out- 1 Roll (4.33"" x 1476') 110mm450m for Zebra ZT410,ZT420,ZT610,105SL,110*i4,140*i4,zt230,Godex ez2300,Citizen s700",https://m.media-amazon.com/images/I/61wB4OV3w4L._AC_UL320_.jpg,19.15,4.5,False,100,Office Electronics
B07R2HBPX1,Smart Ink Remanufactured Ink Cartridge Replacement for HP 65XL 65 XL (Black & Color Combo Pack) to use with DeskJet 3755 3700 2600 2652 3752 2622 2655 3722 2636 2620 Envy 5055 5000 5052 5014 5010,https://m.media-amazon.com/images/I/71TMsniwBqL._AC_UL320_.jpg,25.99,4.5,False,300,Office Electronics
B0849Q3TF3,Be Green Ink Compatible Replacement Black Toner Cartridge for Lexmark MS317dn MS417dn MS517dn MS617dn MX317dn MX417de MX517de MX617de - 51B1000 Black Toner (2.5k Yield),https://m.media-amazon.com/images/I/71eYEJhWA0L._AC_UL320_.jpg,52.99,4.3,False,50,Office Electronics
B08FM44S1S,"Canon PG-243/CL-244 Black and Color Ink Cartridge Value Pack for Select PIXMA IP, MG, MX, TR, TS Series Printers, 2-Pack",https://m.media-amazon.com/images/I/61mvpu5UMTL._AC_UL320_.jpg,0.0,4.6,False,100,Office Electronics
B0BVH6GLCY,"Woolsche Paper Shredder, P-5 Security Level, 6-Sheet Micro Cut with 3.43-Gallon Basket, Durable & Fast with Jam Proof System, Paper Shredder for Home Office (ETL)",https://m.media-amazon.com/images/I/51hShEcyr5L._AC_UL320_.jpg,59.99,4.2,False,400,Office Electronics
B0B4F2ZKZG,Professor Color Re-Coded OEM Toner Cartridge Replacement for Xerox AltaLink C8030 C8035 C8045 C8055 C8070 | 006R01697 006R01698 006R01699 006R01700 - 4 Pack,https://m.media-amazon.com/images/I/81-NxrzyCqL._AC_UL320_.jpg,349.99,3.6,False,0,Office Electronics
B08RHJPZBT,"Palmtree Remanufactured Ink Cartridge Replacement for Canon 240XL 241XL Combo Pack for Ink 240 241 High Capacity for PIXMA MG3620 MG3600 TS5120 MX472 Printer (1 Black, 1 Color)",https://m.media-amazon.com/images/I/71cjIjYYWnL._AC_UL320_.jpg,49.99,4.3,False,700,Office Electronics
B0C3B9G6MG,200 Pack 5 Mil Index Card Laminating Pouches 3x5 File Card Laminating Pouches Lamination Pouches Recipe Card Laminating Pouches for Work Permits Pass Cards Student ID Cards,https://m.media-amazon.com/images/I/61vacDX5g1L._AC_UL320_.jpg,22.58,5.0,False,100,Office Electronics
B086WX1DT9,"Women Calculators,BREIS Creative Cute Solar Energy Calculator, 12 Digit Large LCD Display, Handheld for Daily and Basic Office, Pink (Pink+Pink)",https://m.media-amazon.com/images/I/91d35hPYc1S._AC_UL320_.jpg,12.99,4.7,False,100,Office Electronics
B001V9LQH0,Fujitsu ScanSnap S1500 Instant PDF Sheet-Fed Scanner for PC,https://m.media-amazon.com/images/I/61sW8KEf0GL._AC_UL320_.jpg,679.99,4.5,False,0,Office Electronics
B07YXY2GX3,"Printers Jack Compatiable Epson T522 Refill Ink Bottle Kit for Epson EcoTank ET-2720, ET-4700",https://m.media-amazon.com/images/I/71QInLrLFHL._AC_UL320_.jpg,16.89,4.6,False,900,Office Electronics
B000BP2YDU,"HP 92 Black Ink Cartridge | Works with HP DeskJet 5440; HP OfficeJet 6310; HP PhotoSmart C3100, 7850; HP PSC 1500 Series | C9362WN",https://m.media-amazon.com/images/I/81dF81rAeML._AC_UL320_.jpg,0.0,4.6,False,400,Office Electronics
B0BWWBR4DL,"Red Laser Pointer High Power, High Power Long Range Strong Laser Pointer, Rechargeable Laser Pointer for Presentations",https://m.media-amazon.com/images/I/61IKYAvHPqL._AC_UL320_.jpg,7.99,3.5,False,50,Office Electronics
B0001DU7LI,"Xyron Double Sided Laminate Refill for 850 Creative Station, 8.5"" x 100', Lamination Refill Cartridge (DL201-100)",https://m.media-amazon.com/images/I/81Mu4OPJxqL._AC_UL320_.jpg,46.94,4.8,False,0,Office Electronics
B0BLSW1Z3B,"18 Pieces Pocket Calculator,Pocket Size Mini Calculators,8 Digit Display Basic Calculator,Solar Battery Dual Power Desktop Calculators for Students Kids Home Office (Multicolor, 18 Pieces)",https://m.media-amazon.com/images/I/81fxjTHcHGL._AC_UL320_.jpg,22.29,4.8,False,50,Office Electronics
B0C4KNT6QC,"TMY Mini Projector for iPhone, Portable Projector with 5G WiFi and Bluetooth, 1080P HD Projector【with Tripod】, 9500Lux Movie Projector for iOS/Android/PC/TV Stick/HDMI/AV/USB, Indoor & Outdoor use",https://m.media-amazon.com/images/I/61W83MCaDlL._AC_UL320_.jpg,89.99,4.6,False,400,Office Electronics
B0BQBWCYX1,"280XXL PGBK Ink for Canon 280 PGBK 280 XXL Canon Ink Cartridges Compatible with Canon TR8520 TR8620 TR7520 TS6120 TS6320 TS9120 TS8220 TR8600 TR8500 TR8622 Pinter Ink(PGBK 280 XXL, 2 Pack)",https://m.media-amazon.com/images/I/61O3hJK6osL._AC_UL320_.jpg,27.19,4.9,False,100,Office Electronics
B0C4SGVM3F,SANUNE 65XL Black Ink Cartridges Remanufactured for HP Ink 65 HP65XL Compatible with HP DeskJet 3772 3755 3722 3752 3700 2600 2622 2640 2652 Envy 5055 5000 5070 5052 5010 5014 Printer (2-Pack),https://m.media-amazon.com/images/I/71fKfBKCB5L._AC_UL320_.jpg,29.98,4.7,False,400,Office Electronics
B0BRN9MMDR,"VACASSO Projector, Portable Outdoor Movie Projector with WiFi Bluetooth, Electric Focus, Native 1080P 4K Support, 500 ANSI, Touch Screen, Auto Vertical Keystone and 4P/6D for Phone/PC/TV Stick",https://m.media-amazon.com/images/I/81JX+tgIAXL._AC_UL320_.jpg,199.99,4.4,False,50,Office Electronics
B0CBJL1X4T,"Thermal Laminator, 8.5x11 Laminator, 9 Inch Laminator Machine with 12 Laminating Sheets, A4/A5/A6 Personal Hot Cold Laminating Machine for Home School Teachers Office, Anti-Jam",https://m.media-amazon.com/images/I/71lPaZLrn-L._AC_UL320_.jpg,29.99,4.5,False,200,Office Electronics
B082NXST8V,LCL Compatible Toner Cartridge Replacement for Kyocera TK3122 TK-3122 1T02L10US0 ECOSYS M3550idn FS-4200DN (2-Pack Black),https://m.media-amazon.com/images/I/71akVjKs2zL._AC_UL320_.jpg,49.95,4.8,False,0,Office Electronics
B000BNV9HO,HP 643A Cyan Toner Cartridge | Works with HP Color LaserJet 4700 Series | Q5951A,https://m.media-amazon.com/images/I/71YWna-N45L._AC_UL320_.jpg,0.0,3.9,False,0,Office Electronics
B089SHM2JR,INTBUYING 29.5 in Manual Cold Laminator Machine Vinyl Photo Film Laminating Cold laminator Hand Crank Pressure Cold Roll laminator,https://m.media-amazon.com/images/I/71myr9Sao7L._AC_UL320_.jpg,169.0,4.1,False,0,Office Electronics
B09TSK1VVS,"Printhead (PF-06) Compatible with Canon TA-20/TA-30/TA-5200/TA-5300/TM-200/TM-205/TM-300/TM-305/TM-5200/TM-5205/TM-5300/TM-5305/TX-2000/TX-3000/TX-4000/TX-5200/TX-5300/TX-5400,Print Head Replacement",https://m.media-amazon.com/images/I/71NoHoS-UYL._AC_UL320_.jpg,299.99,1.9,False,0,Office Electronics
B09P32R7TZ,"MUNBYN Android Barcode Scanner with Full Screen 5.5"", 2023 Android 11 Mobile Handheld Computer Wi-Fi 6 MUNBYN Rugged PDA SE4710 Zebra Scanner, Belt Strap, 1D 2D QR Barcode Scanner for Retail Warehouse",https://m.media-amazon.com/images/I/81bTGXLmREL._AC_UL320_.jpg,559.99,4.2,False,0,Office Electronics
B0BVFF4ST3,RM2-6431-000CN Simplex Models Fuser Unit Compatible with Color Laserjet Pro M452nw M477fnw（110V）,https://m.media-amazon.com/images/I/614jjyukKqL._AC_UL320_.jpg,292.99,0.0,False,0,Office Electronics
B00EW4BLGM,"Genuine Xerox 110V Maintenance Kit for the Xerox Phaser 3610 or WorkCentre 3615, 115R00084",https://m.media-amazon.com/images/I/61IdaniYQ1L._AC_UL320_.jpg,198.24,4.3,False,0,Office Electronics
B0BM57HXDS,"Ampro New OEM Modified 148A MICR Toner Cartridge, W1480A MICR Toner Cartridge for Check Printing with HP Laserjet Pro 4001dwe, 4001dw, Laserjet Pro MFP 4101 fdwe, 4101fdw. (Prints 3000 Pages)",https://m.media-amazon.com/images/I/61ZoX+HVyHL._AC_UL320_.jpg,199.0,5.0,False,0,Office Electronics
B07GMVNZ3N,Lexmark 78C1XK0 Black Extra High Yield Return Program Toner Cartridge,https://m.media-amazon.com/images/I/61QqCRBhacL._AC_UL320_.jpg,157.0,3.8,False,50,Office Electronics
B0BJTZGWPH,"myCartridge TN760 Toner for Brother Printer TN760 TN730 Compatible Replacement for Brother TN760 TN730 TN-760 TN-730 for MFC-L2710DW MFC-L2750DW HL-L2370DW Printer,4 Pack Toner TN-730/TN-760",https://m.media-amazon.com/images/I/71yozps-s-L._AC_UL320_.jpg,59.99,4.5,False,50,Office Electronics
B0CFL42XNJ,"L2KB 64XL Ink Cartridge Combo Pack Compatible for HP Ink 64 HP 64 Ink Work with HP Envy Inspire 7955e 7958e HP Envy Photo 6220 6222 7164 7830 7855 7858 7864 HP Tango HP Tango X (Black, Tri-Color) 2PK",https://m.media-amazon.com/images/I/71COyrvOerL._AC_UL320_.jpg,39.99,0.0,False,100,Office Electronics
B0CBKPVN5X,245XL Ink Cartridge Compatible for Canon 245XL Black Ink Canon 245 Works with Canon MX490 Ink Cartridges Canon MX492 Canon TR4520 TR4522 MG2500 MG2522 TS3100 TR4500 for Canon Ink Cartridges 245(2BK),https://m.media-amazon.com/images/I/61eBw3TGIcL._AC_UL320_.jpg,29.99,5.0,False,50,Office Electronics
B07WDNN73D,"Leize Remanufactured Ink Cartridges Replacement for Epson 302 302XL T302XL 5-Pack(BK/PB/C/M/Y) for Expression Premium XP-6000 XP-6100 Printer (T302XL020,T302XL120,T302XL220,T302XL320,T302XL420)",https://m.media-amazon.com/images/I/61mxtczsmTL._AC_UL320_.jpg,48.98,3.9,False,100,Office Electronics
B00CMVZIDO,"DNP 4x6"" Print Media for DS-RX1HS Dye Sub Printer; 700 Prints Per Roll; 2 Rolls Per Case (1400 Total Prints).",https://m.media-amazon.com/images/I/51fqyP7iLnL._AC_UL320_.jpg,203.32,4.8,False,300,Office Electronics
B086PW8PR2,"TRUE IMAGE Compatible Toner Cartridge Replacement for HP 206A 206X W2110A W2110X Color Pro M255dw MFP M283fdw M283cdw M283 M255 Printer Toner (Black Cyan Yellow Magenta, 4-Pack)",https://m.media-amazon.com/images/I/71O7BeaCPpL._AC_UL320_.jpg,93.99,3.1,False,0,Office Electronics
B09K7T92DV,"Xiaomi MI Smart Video Projector 2, 1920x1080 Full HD,Android TV and google assistant built-in, White",https://m.media-amazon.com/images/I/81x66L9WUzL._AC_UL320_.jpg,599.99,4.4,False,0,Office Electronics
B0BYZS1Y6T,910XL Ink Cartridges for HP Printers for HP 910 XL Ink Cartridges Combo Pack Compatible with Officejet Pro 8020 8035e 8025e 8028e 8028 8025 8035 Printer (3 Pack 910 XL Ink Cartridges for HP Printer),https://m.media-amazon.com/images/I/71YvR4130xL._AC_UL320_.jpg,34.99,3.7,False,50,Office Electronics
B0B6B3NMXK,"Wooask Language Translator Device W10 Portable Real-time Voice Translation in 138 Different Languages and Accents for Learning, Travel, Business and Daily Tasks",https://m.media-amazon.com/images/I/616z8bx+ngL._AC_UL320_.jpg,109.99,3.4,False,0,Office Electronics
B08HLLQV1J,"Projector with WiFi and Bluetooth, 13000L Outdoor Movie Projector Native 1080P 5G WiFi 4K Supported, YABER V6 Portable Home Theater Projector, 300"" Display 4P Keystone 50% Zoom Compatible with Phone",https://m.media-amazon.com/images/I/81IWnWpKLzL._AC_UL320_.jpg,101.59,4.2,False,0,Office Electronics
B07WLBGZN5,STAROVER Compatible Toner Cartridges Replacement for Canon 045 045H CRG-045H Toner for Canon Color imageCLASS MF634Cdw MF632Cdw LBP612Cdw LBP612C LBP612 MF632 MF632C 634C MF634 Laser printer (5 Pack),https://m.media-amazon.com/images/I/81TyN9HPnPL._AC_UL320_.jpg,77.92,4.4,False,50,Office Electronics
B0C9PYZ2N4,"ANKINK DR730 Compatible Drum Unit (Not Toner) Replacement for Brother DR-730 DR760 760 for HL-L2350DW HL-L2370DW HL-L2395DW HL-L2325DW MFC-L2750DW MFC-L2710DW L2690DW DCP-L2550DW Laser Printer,2 Pack",https://m.media-amazon.com/images/I/71SDa1xqPrL._AC_UL320_.jpg,45.99,4.6,False,100,Office Electronics
B09FLCNW41,"LCL Compatible Ink Bottle Replacement for Canon GI26 GI-26 BK GI-26BK MAXIFY GX6020 GX6021 GX7020 GX7021 (2-Pack,Black Pigment 170ML)",https://m.media-amazon.com/images/I/71Ne8FR7HtL._AC_UL320_.jpg,25.59,4.8,False,100,Office Electronics
B07SJ4YQGG,"Miss Deer Upgraded LC3033 Ink Cartridges, Replacement for Brother 3033 LC3033XXL LC3033 LC3035XXL LC3035 Work for Brother MFC-J995DW MFC-J805DW MFC-J815DW (1Black, 1Cyan, 1Magenta, 1Yellow) 4 Pack",https://m.media-amazon.com/images/I/71McYNdhmbL._AC_UL320_.jpg,28.89,3.8,False,100,Office Electronics
B092481K9N,"Corded Lip Phone, Benotek Novelty Landline Phone for Home/Office/Shops/Party Decor, Real Wired Funny Mouth Cartoon Telephone for Gift (Rose)",https://m.media-amazon.com/images/I/61E6cwBkciL._AC_UL320_.jpg,17.99,4.5,False,50,Office Electronics
B0002XJU6A,"HP 97 Tri-color Ink Cartridge | Works with HP DeskJet 460, 5000, 6000, 9800; OfficeJet H470, 100, 6200, 7000; PhotoSmart B8350, 300, 400, 2000, 8000; PSC 1600, 2350 Series | C9363WN",https://m.media-amazon.com/images/I/71AKplrIW8L._AC_UL320_.jpg,65.89,4.6,False,200,Office Electronics
B07MZSXDYF,Bigger 12-Pack Replacement for Star SP200 Black Ribbon Used with Star RC200br NK501 T77 SP500 SP-298 SP-500 SP-512mc SP-512md POS Printer,https://m.media-amazon.com/images/I/41MTPaZnNZL._AC_UL320_.jpg,18.99,4.5,False,50,Office Electronics
B01M35FV54,"Kyocera ECOSYS P5026cdw Color Network Laser Printer, 27 ppm, Standard 1200dpi, Standard Duplex, Gigabit Ethernet, USB, Wireless & Wi-Fi Direct, Mobile Print, 512 MB Memory, 2 Line LCD Screen",https://m.media-amazon.com/images/I/710UDbAPxeL._AC_UL320_.jpg,529.0,4.0,False,0,Office Electronics
B00LGCURGI,"Brother Printer LC2072PKS Multi Pack Ink Cartridge, Black - Pack of 2",https://m.media-amazon.com/images/I/71IPuIaskSL._AC_UL320_.jpg,32.9,4.4,False,50,Office Electronics
B07SR1C51S,Canon PIXMA G5020 Wireless MegaTank Single Function SuperTank Printer | Mobile & Auto 2-Sided Printing,https://m.media-amazon.com/images/I/71JIQuf-bWL._AC_UL320_.jpg,149.0,4.1,False,500,Office Electronics
B0B93YX35J,120 Toner Cartridge 2-Pack Compatible Replacement for Canon 120 Toner Cartridge CRG-120 CRG120 for Canon imageCLASS D1120 D1550 D1150 D1320 D1350 D1520 D1100 D1370 D1180 D1170 MF6680DN MF417dw Black,https://m.media-amazon.com/images/I/71+E-xiSVwL._AC_UL320_.jpg,89.99,3.3,False,50,Office Electronics
B000BPLGYS,HP 643A Magenta Toner Cartridge | Works with HP Color LaserJet 4700 Series | Q5953A,https://m.media-amazon.com/images/I/71gEQmiicFL._AC_UL320_.jpg,0.0,4.2,False,0,Office Electronics
B08Z78QHZD,SonilcoⓇ Pickup Roller Kit CC430-67901 RM1-4426 RM1-4425 for HP CM1312 CM2320 CP2025 CP1215 CP1515 CP1518 CM1415 CP1525 Pro 200 M251 MF8050 MF8350 8380 LBP5280,https://m.media-amazon.com/images/I/71d78lK4jyL._AC_UL320_.jpg,9.95,4.5,False,50,Office Electronics
B09J83QNVN,"Poly Edge B30 IP Desk Phone, PoE (Polycom) - Open SIP - Connect to 16 Lines - Power Over Ethernet - Acoustic Fence Technology - RJ9 and 3.5mm Headset Ports - Illuminated Keys Where You Need Them",https://m.media-amazon.com/images/I/61P18J3z4dL._AC_UL320_.jpg,55.55,3.7,False,0,Office Electronics
B0921WF6JF,"Corded White Wall Phone, TelPal Small Analog Wall Telephone for Seniors Home, Single Line Trimline Landline Phones, No AC Power or Battery Required",https://m.media-amazon.com/images/I/51-MrKnAssS._AC_UL320_.jpg,14.98,3.8,False,50,Office Electronics
B00NP6M2YI,"LD Products Compatible Toner Cartridge Replacements for HP 05A HP05A CE505A for use in HP Laserjet P2035, P2035n, P2055d, P2055dn & P2055X (Black, 4-Pack)",https://m.media-amazon.com/images/I/71BWAyJP9hS._AC_UL320_.jpg,49.98,4.3,False,50,Office Electronics
B0B3RBP6JN,"LC3013 5PKS High Yield Compatible Ink Cartridge Replacement for Brother LC3013 LC-3013 LC3011 Work with MFC-J690DW MFC-J895DW Printer (2 Black, 1 Cyan, 1 Magenta, 1 Yellow)",https://m.media-amazon.com/images/I/71ZqYTmKtOL._AC_UL320_.jpg,39.99,4.4,False,300,Office Electronics
B07KYKC8PV,"MxVol Compatible Xerox WorkCentre 3335 3345 Phaser 3330 106R03622 Toner Cartridge use for Xerox 3335 3335/DNI 3345 3345/DNI 3330 3330/DNI Printer, High Capacity 8,500 Pages (1-Pack, Black)",https://m.media-amazon.com/images/I/61pq28EB0ZL._AC_UL320_.jpg,45.19,4.2,False,100,Office Electronics
B00VF1SPUA,"Valuetoner Remanufactured Ink Cartridge Replacement for HP 901XL 901 XL Compatible with Officejet 4500, J4524, J4540, J4550, J4580, J4624, J4680 Printer High Yield (1 Black, 1 Tri-Color, 2 Pack)",https://m.media-amazon.com/images/I/71hTRaptxDL._AC_UL320_.jpg,39.99,4.1,False,200,Office Electronics
B087D5TB7C,Grandstream WP810 Portable Wi-Fi Phone Voip Phone and Device,https://m.media-amazon.com/images/I/51AkLiw30LL._AC_UL320_.jpg,89.0,3.8,False,100,Office Electronics
B015GB9O7C,"E-Z Ink (TM Compatible Ink Cartridge Replacement for Brother LC61 LC-61 LC65 XL to use with MFC-J615W MFC-5895CW MFC-290C MFC-5490CN MFC-790CW MFC-J630W (8 Black, 4 Cyan, 4 Magenta, 4 Yellow) 20 Pack",https://m.media-amazon.com/images/I/8131EnD81PL._AC_UL320_.jpg,27.99,4.4,False,200,Office Electronics
B09N8WF9XM,Leize Compatible Toner Cartridge Replacement for Samsung 404S CLT-404S to use for Xpress C480FW C430W SL-C430W SL-C480FW SL-C480FN Printer CLT-K404S CLT-C404S CLT-M404S CLT-Y404S [KCMY-4 Packs],https://m.media-amazon.com/images/I/71JUWF4AIFL._AC_UL320_.jpg,58.99,3.8,False,0,Office Electronics
B09DK5FVKV,DY LW 550 Turbo Printer EMEA,https://m.media-amazon.com/images/I/81REnJvCXAL._AC_UL320_.jpg,112.3,3.4,False,0,Office Electronics
B0BZ4G2HZP,65XL Black Ink Cartridge High Yield Replacement for HP Ink 65 HP 65 Black Ink Cartridge Works with HP Deskjet 3772 3755 3700 3722 3752 2600 2622 2652 Envy 5055 5000 5070 5052 5014 Printer (2 Black),https://m.media-amazon.com/images/I/71DoZJFPLEL._AC_UL320_.jpg,49.99,4.7,False,1000,Office Electronics
B06XDMWZ7L,7Magic Remanufactured Toner Cartridge Replacement for HP 305A 305X CE410X CE410A for HP Pro 400 Color MFP M451nw M451dn M451dw M475dw M475dn Pro 300 MFP M375nw M351A Printer (4 Pack),https://m.media-amazon.com/images/I/81-DAMwD6BL._AC_UL320_.jpg,67.89,4.3,False,200,Office Electronics
B08WRXDSM9,"Aztech Compatible Toner Cartridge Replacement for HP 81X CF281X 81A CF281A Enterprise MFP M605 Toner M605n M605dn M605x M606 M606n M630 M630h M630dn M630z M632 Printer (Black, 1-Pack)",https://m.media-amazon.com/images/I/61xn-6AGyKL._AC_UL320_.jpg,70.99,3.9,False,0,Office Electronics
B09LRGRDC3,"Yealink T58W 16 Lines. 7-Inch Color Touch Screen Display. Dual USB Ports, Dual-Port Gigabit Ethernet, PoE, Power Adapter Not Included (SIP-T58W)",https://m.media-amazon.com/images/I/510qMwPHv0L._AC_UL320_.jpg,272.85,4.0,False,0,Office Electronics
B0BGVGDB72,"Optoma UHD38x Bright, True 4K UHD Gaming Projector | 4000 Lumens | 4.2ms Response Time at 1080p with Enhanced Gaming Mode | Lowest Input Lag on 4K Projector | 240Hz Refresh Rate | HDR10 & HLG",https://m.media-amazon.com/images/I/61kNqVanxAL._AC_UL320_.jpg,899.0,3.9,False,0,Office Electronics
B081P8YMS5,Brother LC20EBK Super High Yield Black Ink Cartridge - 2 Pack,https://m.media-amazon.com/images/I/71cngFiwZ7L._AC_UL320_.jpg,49.99,4.4,False,0,Office Electronics
B07NJ2T8H2,HP LaserJet Enterprise M507dn Monochrome Printer with built-in Ethernet & 2-sided printing (1PV87A) White,https://m.media-amazon.com/images/I/613Bq+-8+uL._AC_UL320_.jpg,878.9,4.3,False,50,Office Electronics
B07655TGYR,"KODAK Verite 5 Replacement Inks (ASK1CA) Standard Black Ink Jet Cartridge Compatible Verite Printers V50, V55, V55W Eco, V55 Plus, V60 Eco, V640 Eco, V64 Series, V65 Eco, V65 Plus",https://m.media-amazon.com/images/I/61eNCD4scyL._AC_UL320_.jpg,39.99,4.6,False,100,Office Electronics
B00BR417HS,Brother Printer WT220CL Waster Toner Box Toner,https://m.media-amazon.com/images/I/61qF9ghEd-L._AC_UL320_.jpg,26.99,4.4,False,500,Office Electronics
B0BNMWYVKJ,055 055H MF743Cdw Standard Capacity Black Toner Cartridge 2 Pack Compatible Replacement for Canon 055 CRG-055 for Canon Color ImageCLASS MF743Cdw MF741Cdw MF746Cdw MF740C MF745Cdw LBP664Cdw Printer,https://m.media-amazon.com/images/I/719eH2OqIHL._AC_UL320_.jpg,88.99,3.4,False,0,Office Electronics
B0006B088W,"Plantronics HL10 Handset Lifter, Gray",https://m.media-amazon.com/images/I/41cy8CKS0bL._AC_UL320_.jpg,40.78,4.5,False,0,Office Electronics
B08JYZT2W4,"Advanced Home Telephone, Interesting Mouth Lip-Shaped , Funny Pink Lip Plastic Telephone Cable, Wire Phone Home Decoration, A for Friends or Families House Phone",https://m.media-amazon.com/images/I/51DyeJN3iGL._AC_UL320_.jpg,26.88,4.5,False,0,Office Electronics
B001KDMKKY,"LD Compatible Ink Cartridge Replacements for Brother LC61 (4 Black, 2 Cyan, 2 Magenta, 2 Yellow, 10-Pack)",https://m.media-amazon.com/images/I/71upM2CIGjS._AC_UL320_.jpg,17.99,4.2,False,0,Office Electronics
