asin,title,imgUrl,price,stars,isBestSeller,boughtInLastMonth,category_name
B0BXGDPM9Z,"OYIB Wireless Earbuds Bluetooth 5.3 Headphones 40hrs Play Sport Earphones with Dual LED Display, IP7 Waterproof Running Earphones with Earhooks, Touch Control Headset with Immersive Sound for Workout",https://m.media-amazon.com/images/I/71RAVZly6XL._AC_UL320_.jpg,16.99,4.5,False,0,Headphones & Earbuds
B0CFXRLMWN,"Monster Wireless Earbuds, Achieve 300 AirLinks Bluetooth Headphones Touch Control with Charging Case, Bluetooth Earbuds, Black",https://m.media-amazon.com/images/I/71p8WuLwn2L._AC_UL320_.jpg,79.99,5.0,False,0,Headphones & Earbuds
B09XHVBLD7,Wireless Earbuds Sport Bluetooth 5.1 Earphones in-Ear with Immersive Sound 24H Playtime IPX5 Waterproof Stereo Headphones in Ear Built in Mic Headset Premium Sound Compatible with Apple & Android…,https://m.media-amazon.com/images/I/51zmMt8PhYL._AC_UL320_.jpg,10.99,4.2,False,0,Headphones & Earbuds
B09SHMD7LJ,"Hliavvei X13 Bluetooth Earbuds 5.1, Single Bluetooth Earbuds, Microphone Calls, Invisible Earbuds,Smart Touch,Waterproof,Sports Earbuds,Charging Case Earbuds,in-Ear Earbuds,Sleep Headphones",https://m.media-amazon.com/images/I/61FlL6UFykL._AC_UL320_.jpg,19.9,3.6,False,0,Headphones & Earbuds
B00DCXZY1W,"AKG Pro Audio K612 PRO Over-Ear, Open-Back, Premium Reference Studio Headphones",https://m.media-amazon.com/images/I/61-ZIlLUZQL._AC_UL320_.jpg,190.94,4.2,False,0,Headphones & Earbuds
B0BXCS2K4T,"Earclip Headphones Bluetooth 5.3 Bone Conduction, Painless Comfortable Wireless Earbuds, Waterproof Open Ear Earring Earphone for Sports Running, Noise Cancellation/High Fidelity/Long Battery Life",https://m.media-amazon.com/images/I/51d5PqivSHL._AC_UL320_.jpg,19.99,3.1,False,0,Headphones & Earbuds
B07V2H28GF,"AMORNO Foldable Bluetooth Headphones, Wireless Neckband Sports Headset with Retractable Earbuds, Sweatproof Noise Cancelling Stereo Earphones with Mic (Black)",https://m.media-amazon.com/images/I/61AqwkvGaQL._AC_UL320_.jpg,29.99,4.0,False,0,Headphones & Earbuds
B0BYPLXQBL,"Maxell Kids Overear Headset with Boom Mic -Safe Listening with 85dB-95dB Volume Limiting, Flexible Boom Mic, Chew Proof Cord, Mute & Volume Control, Share Port",https://m.media-amazon.com/images/I/61EspEbOabL._AC_UL320_.jpg,22.27,0.0,False,0,Headphones & Earbuds
B087CMP61Z,"Srhythm NC15 Noise Cancelling Headphones Bluetooth Over-Ear Headset with Mic for Teens, Adults Online Class/Home Office/TV/PC/Phone",https://m.media-amazon.com/images/I/71gWNwgsH+L._AC_UL320_.jpg,39.99,4.0,False,0,Headphones & Earbuds
B09C1LMXT6,"TOZO G1 Wireless Earbuds Bluetooth 5.3 Headphones with 45ms Ultra Low-Latency and Cool Breathing Light, Ergonomic Design, Gaming/Deep Bass Music Mode Headset Built-in Microphone, Stereo Sound, Black",https://m.media-amazon.com/images/I/61L4ZajO81L._AC_UL320_.jpg,19.99,4.4,False,0,Headphones & Earbuds
B091JJ4MJQ,"RIG 500 PRO HX 3D Audio Gaming Headset for Xbox Series X|S and Xbox ONE, Certified RECONDITIONED (Renewed)",https://m.media-amazon.com/images/I/811mH-5zXVL._AC_UL320_.jpg,28.86,4.0,False,0,Headphones & Earbuds
B0BPPNVJJG,"Open Ear Earbuds Sport Open Earbuds Wireless Bluetooth Earbuds with Earhooks 30Hrs Playtime with Charging Case and LED Power Display Sweat Resistant for Outdoor Sports, Running and Workouts, Blue",https://m.media-amazon.com/images/I/61LNMIn4z9L._AC_UL320_.jpg,25.99,3.5,False,0,Headphones & Earbuds
B07CRHH56F,"JVC True Wireless Earbuds for Sports & Fitness, Sweat/Water Proof IPX5, Bluetooth Connectivity, Pivot Motion Fit, 3 Point Support Structure, 3+6 Hours Battery Life - HAET90BTB (Black)",https://m.media-amazon.com/images/I/61kREe4aDFL._AC_UL320_.jpg,25.99,3.4,False,0,Headphones & Earbuds
B01CZUJACQ,"StorageWorks Large Storage Baskets for Organizing, Foldable Storage Baskets for Shelves, Fabric Storage Bins with Handles, Beige, White & Ivory, 3-Pack",https://m.media-amazon.com/images/I/61OY5ZMlYxL._AC_UL320_.jpg,25.99,4.7,False,1000,Home Storage & Organization
B08L8WJ1F1,"Mkono Wood Sunglasses Storage Organizer Wall Mounted Rustic Eyeglasses Display Holder Eyewear Glasses Hanging Rack for Entryway Living Room Bedroom, 3 Pack, Brown",https://m.media-amazon.com/images/I/81Jqoi+MJ7L._AC_UL320_.jpg,16.99,4.7,False,200,Home Storage & Organization
B08KXLH2SX,"Dissolvable Food Labels for Food Containers - Made in USA - Great for Food Prep, Pantry, Canning, Freezer, Mason Jar Storage, Bottles and Rotation– No Scrubbing, No Residue - Teal",https://m.media-amazon.com/images/I/81vouJ2nIGL._AC_UL320_.jpg,12.99,4.7,False,200,Home Storage & Organization
B087WM3CL6,50 Pack Individual Cupcake Containers Plastic Cupcake Boxes Cupcake Holders Stackable Deep Dome Cupcake Carrier,https://m.media-amazon.com/images/I/71lpCvAe3hS._AC_UL320_.jpg,9.58,4.8,False,2000,Home Storage & Organization
B09CDGPBKB,"KINGMAS Reusable Grocery Bags, Eco-Friendly Folding Tote Shopping Bag fits in Pocket, Washable Waterproof Nylon Pouch Bags",https://m.media-amazon.com/images/I/91FAKZwtrXL._AC_UL320_.jpg,7.99,4.7,False,400,Home Storage & Organization
B07BL5RVKQ,"Dowell 30"" x 21"" Drawer Organizer Wood Peg Board - 12Pegs",https://m.media-amazon.com/images/I/6164ZMTkbmL._AC_UL320_.jpg,108.9,4.8,False,0,Home Storage & Organization
B0BTYGKYDS,"Yecaye 3 Pack Drawer Organizers for Clothing, Foldable Closet Organizers and Storage, Organizer Storage Bins for Closet Bedroom, Storage Basket Cubes for Clothes Underwear L11.62” W11.62” H6.89”, Grey",https://m.media-amazon.com/images/I/71714Bd2R-L._AC_UL320_.jpg,16.19,4.5,False,0,Home Storage & Organization
B0BJPFS1TV,"Bike Racks for Garage Wall, Bicycle Home Storage Adjustable Bike Hanger 2-Pack Wall Mount Bike Rack Garage System Vertical Bike Hooks",https://m.media-amazon.com/images/I/615KUhw1TzL._AC_UL320_.jpg,14.99,3.9,False,0,Home Storage & Organization
B08D69VCW6,HECASA Wall-Mounted Lumber Storage Rack 6 Level 600Lb Wood Organizer Rack (1 PACK),https://m.media-amazon.com/images/I/71kSmTsh52L._AC_UL320_.jpg,37.49,4.4,False,0,Home Storage & Organization
B0C938N5VC,"Olympia Tool Bag 12 Inch, Heavy Duty Tools Bag with 3 Large Pockets, Adjustable Shouder Straps and 600D Reinforced Material",https://m.media-amazon.com/images/I/91KQeFvXg1L._AC_UL320_.jpg,17.99,4.8,False,0,Home Storage & Organization
B081D92HMK,Green Ergonomic Replacement Bucket Handles 2 Pack,https://m.media-amazon.com/images/I/61GMcSq7LJL._AC_UL320_.jpg,9.0,4.4,False,0,Home Storage & Organization
B0B2X85431,"ONGROK Glass Storage Jar, 80ml, 6 Pack, Color-Coded Airtight Containers, UV Herb/Spice Jar to with Child Resistant Lid, Perfect Size to Store in a Drawer or Cupboard",https://m.media-amazon.com/images/I/51qTUrBpTDL._AC_UL320_.jpg,29.99,4.4,False,200,Home Storage & Organization
B08XN14XG1,"Tool Box Liner 24 inch Wide x 24 ft Large 4mm Thick, Heavy Duty Toolbox Drawer Liners, Rolling Tool Chest Liner Foam, Shelf Rubber Mat, Non-Slip Organizer Liner for Cabinet, Cart, Work Bench",https://m.media-amazon.com/images/I/81GytJrACML._AC_UL320_.jpg,64.99,4.6,False,100,Home Storage & Organization
B0C4B2CK3S,"Metal Shoe Rack Organizer，8 Tiers Tall Shoe Shelf Storage，40-45 Pairs Vertical Large Boot Rack,Stackable Shoe Racks for Entryway, Closet, Garage, Bedroom,Cloakroom -Black",https://m.media-amazon.com/images/I/819wHIIrY5L._AC_UL320_.jpg,33.99,4.4,False,1000,Home Storage & Organization
B01M06BTV3,6 Pack - SimpleHouseware 3 Compartment Food Grade Meal Prep Storage Container Boxes (36 ounces),https://m.media-amazon.com/images/I/819pu469X5L._AC_UL320_.jpg,10.87,4.5,False,100,Home Storage & Organization
B09MZ5D37Q,"8-Tier Shoe Rack Storage Organizer, 25-28 Pairs Shoes Shelf Organizer, Removable & Dust Large Stackable Shoe Rack for Boot & Shoe Storage",https://m.media-amazon.com/images/I/81svNZWxKNL._AC_UL320_.jpg,29.97,4.5,False,800,Home Storage & Organization
B08VSF114Y,"Edward Tools 9.5” Rectangle Magnetic Tray and 6” Round Magnetic Tray - For Screws, Nut, Bolts, Small Tools - Great for Mechanics, DIY - Heavy Duty Stainless Steel - Extra Strength Magnet",https://m.media-amazon.com/images/I/61N1pNyAe8L._AC_UL320_.jpg,13.95,4.7,False,0,Home Storage & Organization
B0B8YD7TYT,"Pots and Pans Organizer for Cabinet, 8 Tier Adjustable Cabinet Pan Organizer Rack Heavy Duty 21"" Pot Organizer for Kitchen Organization & Storage, Snap-on Pot Lid Organizer for Stockpot (White)",https://m.media-amazon.com/images/I/81crgI6b-iL._AC_UL320_.jpg,29.99,4.5,False,50,Home Storage & Organization
B0C83KJH4K,Vented Paper Pulp Egg Cartons - Blue (12),https://m.media-amazon.com/images/I/81zY+LidutL._AC_UL320_.jpg,16.99,5.0,False,100,Home Storage & Organization
B003H9N68Y,"Akro-Mils 30287 Super-Size AkroBin Heavy Duty Stackable Storage Bin Plastic Container, (24-Inch L x 11-Inch W x 10-Inch H), Blue, (4-Pack)",https://m.media-amazon.com/images/I/51HOKQqDCNL._AC_UL320_.jpg,124.98,4.4,False,0,Home Storage & Organization
B07G2P529N,"5 gallon Heavy Duty Stackable Home Storage Bins (6 Pack) With Secure Lids, Storage Totes for Closet Organization, Toys storage, Tool Storage, or School and Office Supplies. By Safari USA",https://m.media-amazon.com/images/I/71VUdrBfhgL._AC_UL320_.jpg,89.99,4.3,False,0,Home Storage & Organization
B01BARBGJA,Quickn'Clean Disposable Paint Bucket Liners 5-Pack. Custom fits Purdy® Dual roll Off Bucket.,https://m.media-amazon.com/images/I/91tNhjZs6lL._AC_UL320_.jpg,6.49,4.5,False,100,Home Storage & Organization
B00PP0LETQ,"Lynk® Over Door Hooks Rack - 9 Hook Over Door Hanger - Over Door Towel Rack - Over Door Hooks for Hanging Towels, Clothes, Hats - Over Door Towel Racks - For Bathroom, Bedroom or Laundry Room (Bronze)",https://m.media-amazon.com/images/I/81r4YbnsBXL._AC_UL320_.jpg,17.99,4.7,False,300,Home Storage & Organization
B091YBPSDQ,"30-Piece Drawer Organizer with Non-Slip Silicone Pads, 7-Size Desk Drawer Organizer Trays Storage Tray for Makeup, Jewelries, Utensils in Bedroom Dresser, Office and Kitchen (Clear)",https://m.media-amazon.com/images/I/81+dLjunhyL._AC_UL320_.jpg,36.99,4.7,False,300,Home Storage & Organization
B0000DD1PE,"B&W International TUC-11601 Technician Notebook Tool Bag with Pocket Pallets,Black",https://m.media-amazon.com/images/I/61JOmc+JMIL._AC_UL320_.jpg,59.95,4.5,False,0,Home Storage & Organization
B000V2FKF2,Occidental Leather 9525 M The Finisher Tool Belt Set - Medium,https://m.media-amazon.com/images/I/612qzO6gdzL._AC_UL320_.jpg,299.9,4.6,False,0,Home Storage & Organization
B0C9LFM84H,"Bento Lunch Box and Snack Containers - 4 Compartments, Durable and Safe Lunch Containers for Adults Kids with Transparent Lid, Microwave Safe, BPA free - Set of 4 (PP (Green/Blue/Pink/Beige))",https://m.media-amazon.com/images/I/711j0i8-nrL._AC_UL320_.jpg,21.99,4.7,False,700,Home Storage & Organization
B08ZXY2LHJ,"Greenstell Laundry Hamper with Lid, 125L Large 3 Sections Clothes Hamper with 2 Types Removable Liner Bags & 5 Mesh Laundry Bags, Handwoven Synthetic Rattan Divided Laundry Basket Brown",https://m.media-amazon.com/images/I/81Wk1Qy8xCL._AC_UL320_.jpg,69.99,4.5,False,200,Home Storage & Organization
B01LBMY9ZC,Trademark Innovations 4-Tier Wire Spice Rack Storage Organizer - Wall Mount or Countertop,https://m.media-amazon.com/images/I/71oOxPsBmRL._AC_UL320_.jpg,31.99,4.2,False,0,Home Storage & Organization
B0BBMN6GFT,"Amazer Mug Rack 3 Pack, Metal Sturdy Under Cabinet Coffee Mug Holder, Hanging Mug Hooks Under Cabinet, Display Mug Organizer Mugs Hanger Under Shelf for Coffee Cup & Kitchen Utensils Storage, Black",https://m.media-amazon.com/images/I/7120zUcz82L._AC_UL320_.jpg,7.97,4.4,False,0,Home Storage & Organization
B0BHL49F9T,"6 Pack Clear Plastic Drawer Organizer Set, Acrylic Non Slip Non Cracking Kitchen Drawer Storage Tray Large Size Divider, Multifunctional Storage for Cosmetics, Bathroom, Tools, Kitchen and Office",https://m.media-amazon.com/images/I/714yKNYx3FL._AC_UL320_.jpg,19.99,4.7,False,0,Home Storage & Organization
B0BHRQDQZ2,"Wide Mouth Tool Bag, Canvas Tool Tote Bag Storage Handbag with Large Capacity, Waterproof, Ideal for Car Repair Carpentry(30cm/12in)",https://m.media-amazon.com/images/I/714LCQe6ZOL._AC_UL320_.jpg,9.99,4.0,False,0,Home Storage & Organization
B0009H5P7W,Occidental Leather 5062 4 Pouch Pro Fastener Bag,https://m.media-amazon.com/images/I/61edoZbwHkL._AC_UL320_.jpg,129.9,4.8,False,100,Home Storage & Organization
B0C1GNDVWH,"SONGMICS Luggage Rack, Folding Suitcase Stand with Storage Shelf, for Guest Room, Hotel, Bedroom, Heavy-Duty, Holds up to 131 lb, Walnut Brown URLR007D01",https://m.media-amazon.com/images/I/81OHrENZMlL._AC_UL320_.jpg,45.99,4.5,False,200,Home Storage & Organization
B0C2YSXHWV,"6 pack 40"" Clear Garment Bags for Hanging Clothes, Suit Bags for Closet Storage, Clothing Storage, Garment Bags for Travel Covers with 4"" Gussets for Coats, Jackets, Shirts, Dresses & Sweater",https://m.media-amazon.com/images/I/81Tft35pDYL._AC_UL320_.jpg,19.99,4.6,False,400,Home Storage & Organization
B0BQRCJTGG,"Vtopmart 70oz Glass Food Storage Jars, Set of 3 Large Food Containers with Airtight Bamboo Wooden Lids for Pasta, Nuts, Flour, Glass Canisters for Kitchen, Pantry Organization and Storage, BPA Free",https://m.media-amazon.com/images/I/81JANhPugqL._AC_UL320_.jpg,22.99,4.7,False,600,Home Storage & Organization
B08VFK4WS6,2 Pc 47oz Clear Glass Milk Bottles Glass Pitcher with Handle and Lids - Airtight milk Container for Refrigerator Jug Water Juice Heavy Milk Bottle Liquid Containers for Kitchen,https://m.media-amazon.com/images/I/61vZRQDzzlL._AC_UL320_.jpg,22.99,4.7,False,1000,Home Storage & Organization
B0BVFTK1WY,"Rutile 10'x20' Carport Canopy ONLY Tent Garage Replacement Top Tarp Car Shelter Cover w/Ball Bungees Beige (Only Top Cover, Frame is not Included)",https://m.media-amazon.com/images/I/51VLJkYtXPL._AC_UL320_.jpg,89.99,4.0,False,100,Home Storage & Organization
B0BPFXBPP2,Stove Top Shelf 30 Inch - Silicone Material Magnetic Shelf for the Stove - 3 Functional Partitions Kitchen Spice Rack Organizer - Black,https://m.media-amazon.com/images/I/71zx5Vy8u+L._AC_UL320_.jpg,19.99,4.4,False,600,Home Storage & Organization
B0BGRKR1B2,"Gladiator 28"" Hardwood Top, GAAC28HWGX & Ready-to-Assemble Modular Gearbox Caster Kit, GACK04KDSX",https://m.media-amazon.com/images/I/41KD5-ETRTL._AC_UL320_.jpg,117.48,4.6,False,0,Home Storage & Organization
B00006IBLN,"Command Jumbo Utility Hooks, Damage Free Hanging Wall Hooks with Adhesive Strips, Wall Hooks for Hanging Back to School Dorm Organizers, 1 White Hook and 4 Command Strips",https://m.media-amazon.com/images/I/71OC9VsosOL._AC_UL320_.jpg,3.49,4.7,False,0,Home Storage & Organization
B0BRX8KKKW,"Home Sink Caddy, Instant Dry Bathroom Sink Organizer, Fast Drying Diatomaceous Earth Stone Sink Tray Dish for Soap Sponge holder Toothbrush Cup, Stainless Steel Feet with Rubber Bottom, Grey",https://m.media-amazon.com/images/I/7196E6hEeTL._AC_UL320_.jpg,11.99,4.8,False,200,Home Storage & Organization
B07GPR51PF,"Clothespins, Standard Natural Wooden, Stain Proof, 3 inch, 200 Value Pack, for Multipurpose Everyday Laundry, Clothes, Towels, Craft, Photos, Pictures, Decor, Baby Shower, Art Wall",https://m.media-amazon.com/images/I/71DyfX0DVgL._AC_UL320_.jpg,19.97,4.6,False,200,Home Storage & Organization
B09BRD73Z3,"Kids Velvet Clothes Hangers, Non Slip Baby Hangers Pink (11.6"" Inch - 40 Pack)",https://m.media-amazon.com/images/I/51EiaHBKA1L._AC_UL320_.jpg,19.99,4.8,False,300,Home Storage & Organization
B07T9HRFJ6,"Zak Designs Minecraft - Stainless Steel Water Bottle with One Hand Operation Action Lid and Built-in Carrying Loop, with Straw Spout is Perfect for Kids (15.5 oz, 18/8, BPA-Free)",https://m.media-amazon.com/images/I/61M0+WFIyML._AC_UL320_.jpg,11.99,4.6,False,500,Home Storage & Organization
B07ZM14QG5,"120 Gallon Outdoor Storage Deck Box Resin Container Weatherproof Deck Storage Box Containers Patio Garden Furniture Outdoor Storage Boxes All Weather Using,Grey",https://m.media-amazon.com/images/I/71I9gyklSKL._AC_UL320_.jpg,85.98,4.3,False,0,Home Storage & Organization
B0BWN9VGJW,"Water Bottle Organizer, Stackable Kitchen Home Pantry Organization and Storage Shelf, Plastic Water Bottle Holder for Fridge Cabinet Organizer and Storage, Tumbler Travel Mug Cup Organizer",https://m.media-amazon.com/images/I/81QZaPmT3XL._AC_UL320_.jpg,32.99,4.7,False,900,Home Storage & Organization
B0BKQ575Z3,"C&AHOME Kids Toy Cartoon Cube Storage Organizer with Doors, 12-Cube Shelves, Closet Cabinet, DIY Plastic Modular Bookshelf Ideal for Bedroom, Living Room, 42”L x 14”W x 56”H Pink UPCS3512P-DOOR",https://m.media-amazon.com/images/I/71jzk+5tEtL._AC_UL320_.jpg,65.99,4.2,False,0,Home Storage & Organization
B07PZ8KZ4G,Fellow Atmos Vacuum Coffee Canister & Food Storage Container - Airtight Food Storage Containers - Coffee Containers - 16 oz - Matte Black,https://m.media-amazon.com/images/I/51xnKFwLdAL._AC_UL320_.jpg,40.0,4.0,False,700,Home Storage & Organization
B0C4TFV8QR,"Portable Wardrobe Storage Closet, Clothes Storage Cabinet with Curtain, for Living Room, Bedroom, Clothes Room, Black",https://m.media-amazon.com/images/I/61NFj8svDtL._AC_UL320_.jpg,39.99,3.4,False,600,Home Storage & Organization
B08JTYNL1M,"MIXPOWER 15-inch 2pcs Toolbox Organizer Sets, 20 Removable Dividers, Durable Plastic Box, Excellent for Screws, Nuts, Small Parts, 34-Compartment Black/Orange 2 Pieces Set",https://m.media-amazon.com/images/I/71hfNbomiDL._AC_UL320_.jpg,29.97,4.5,False,100,Home Storage & Organization
B0BKSP4QPV,"Key Holder for Wall, Mail Organizer Wall Mount with Key Hooks and Wallet Holder, Sunglasses Storage and Dog Leash Holder, Wall Decorative with 4 Double Hooks and Chalkboard",https://m.media-amazon.com/images/I/81WQmaTXvPL._AC_UL320_.jpg,34.99,4.4,False,0,Home Storage & Organization
B0099JYOT6,"Protoco 3021 Standard Wrench Rack, 15 Piece Magnetic, Tool Organizer for Tool Box, Tool Cart or Wall Mounted, Red",https://m.media-amazon.com/images/I/51RQkSVf0YL._AC_UL320_.jpg,19.15,3.9,False,0,Home Storage & Organization
B07CR5C7FF,Wrench & Tool Bag Organizer Roll Up Bag One Touch Closer Flap Closure Hand Crafted H.W. Hand Dyed 100% Cotton Duck Canvas Metric or SAE,https://m.media-amazon.com/images/I/81w3KIdSM0L._AC_UL320_.jpg,17.04,4.2,False,0,Home Storage & Organization
B0051ABLF2,DeWalt 179211 Pro Round Top Bag 1-79-211,https://m.media-amazon.com/images/I/41u06Jswl6L._AC_UL320_.jpg,118.48,4.8,False,0,Home Storage & Organization
B000UHH5VU,Pit Posse 546 Duct Tape Holder Double Bracket Universal - Made in USA - for Garage Enclosed Trailer Shop Storage Organizer Motorcycle Automotive Race Aluminum Accessories - Holds 2 Rolls (Silver),https://m.media-amazon.com/images/I/519UtN9dyHL._AC_UL320_.jpg,17.95,4.5,False,0,Home Storage & Organization
B0C6MKKCPY,"6 Packs Acrylic Display Case, Purse and Handbag Storage Organizer for Closet, Plastic Clear Purse Storage Boxes with Magnetic Door for Bag Toy Wallet Book",https://m.media-amazon.com/images/I/71QEY140JJL._AC_UL320_.jpg,70.99,0.0,False,0,Home Storage & Organization
B0C2KMVXK4,"Under Bed Storage Containers-6 Pack 90L Foldable Large Capacity Underbed Storage Bags with Reinforced Handles, Clear Window for Clothes, Bedding, Blanket",https://m.media-amazon.com/images/I/71Fo4nYT5gL._AC_UL320_.jpg,35.99,4.4,False,200,Home Storage & Organization
B00279NAPO,"Custom Leathercraft - DW-109 CLC K485R1 Standard Drywaller's Tool Pouch, Chrome-Tanned Heavy Duty, 7-Pocket, Small",https://m.media-amazon.com/images/I/61vDhi9dDhL._AC_UL320_.jpg,32.43,4.4,False,50,Home Storage & Organization
B0BXL3XXS4,"64 Oz Insulated Water Bottle With Straw & Paracord Handles & 2 Lids, Leak Proof Metal Water Jug, Hot Cold Stainless Steel Thermal Water Bottles, Half Gallon Large Water Flask for Sports, Gym",https://m.media-amazon.com/images/I/61KaRAUMwuL._AC_UL320_.jpg,23.74,4.7,False,400,Home Storage & Organization
B09QM7872T,"5 Pack Shelving Hooks for Keyhole Shelves Organization, Utility Shelves Hooks for Clothes, Hats, Garden Tool Bags, Chainsaws, Cords, Tools Equipment",https://m.media-amazon.com/images/I/61ldSbdoNqL._AC_UL320_.jpg,29.99,4.6,False,0,Home Storage & Organization
B07NVXF178,"Suncast 99 Gallon Deck Garden Garage Home Wicker Resin Pool Box, White (2 Pack)",https://m.media-amazon.com/images/I/71wZcGKW4-L._AC_UL320_.jpg,355.99,5.0,False,0,Home Storage & Organization
B084DBGJQB,MILWAUKEE'S 48-22-8422 PACKOUT Compact Tool Box (1),https://m.media-amazon.com/images/I/51R2LHBscQL._AC_UL320_.jpg,0.0,4.8,False,50,Home Storage & Organization
B09HSN9WTN,"Set Of 8 Refrigerator Pantry Organizer Bins - 4 Big And 4 Small Clear Food Storage Baskets for Kitchen, Countertops, Cabinets, Freezer, Bedrooms, Bathrooms - Plastic Household Storage Containers",https://m.media-amazon.com/images/I/917fMMULLsL._AC_UL320_.jpg,29.99,4.8,False,1000,Home Storage & Organization
B09VGBVHYH,"Closet Storage Bins, Trapezoid Storage Baskets with Handle, Closet Organizer Bins for Closet Organization for Organizing Shelves , Clothes, Books, Toys, 3 Packs, Blended",https://m.media-amazon.com/images/I/71ql6wpw1KL._AC_UL320_.jpg,26.99,4.6,False,50,Home Storage & Organization
B07CV1GL3D,"GEARWRENCH 16"" Handled Tote Bag - 83146",https://m.media-amazon.com/images/I/71-IVDL+oYS._AC_UL320_.jpg,42.99,4.6,False,0,Home Storage & Organization
B07P7PBZP9,"SONGMICS Stackable Storage Bins, Set of 2 Fabric Storage Boxes with Lids, with Magnetic Closures, Lid Can Stay Open After Stacking, 19.7 x 13.8 x 9.8 Inches, Light Gray URLB03GY",https://m.media-amazon.com/images/I/91EtpMB31rL._AC_UL320_.jpg,31.99,4.5,False,100,Home Storage & Organization
B0C5DMQL5W,"APSOONSELL Closet Organizers and Storage for Clothes, Foldable Wardrobe Clothes Organizer with Removable Dividers, Jeans Organizer for Closet, Drawer Organizer Clothes for Pants Shirts Sweaters (3PC)",https://m.media-amazon.com/images/I/815NosmNliL._AC_UL320_.jpg,27.99,4.7,False,0,Home Storage & Organization
B07C7WT4ZK,"Heavy-Duty Tool Belt Suspenders for Men, 3 Point Padded Suspenders Construction Suspender for Tool Belt",https://m.media-amazon.com/images/I/619HSJJcXML._AC_UL320_.jpg,17.8,4.4,False,50,Home Storage & Organization
B094V9X73S,"Ski Wall Rack Snowboard Wall Mount Storage Rack Holds 5 Pairs of Skis & Skiing Poles or Snowboard, for Home and Garage,2 Set",https://m.media-amazon.com/images/I/71deyZt7dvL._AC_UL320_.jpg,24.99,4.3,False,0,Home Storage & Organization
B0BFQYNRWH,"Jewelry Holder Organizer Earring Stand with 28 Necklace Hooks, 360 Rotating Necklace Holder Earrings Storage Rack Jewelry Tower Bracelet Holder, Holds More than 100 Pairs Earrings -Black",https://m.media-amazon.com/images/I/71MWFrJNjGL._AC_UL320_.jpg,22.99,4.6,False,400,Home Storage & Organization
B0002RI6W0,"Klein Tools 5710M Electrician's Powerline Padded Tool Belt and Tool Pouch Combo, Medium, 4-Piece Black Leather",https://m.media-amazon.com/images/I/51FE2KyQ5QL._AC_UL320_.jpg,145.99,4.4,False,0,Home Storage & Organization
B0B49YXSVK,Denim Apron with Pockets Adjustable Cooking Apron Jean Apron with Multi Pockets for Kitchen Cooking BBQ Gardening,https://m.media-amazon.com/images/I/81IbPrypquL._AC_UL320_.jpg,24.37,4.5,False,0,Home Storage & Organization
B00RVLH3YW,"Rubbermaid Free-Sliding Wire Shelf, White, Adjustable Shelving with Free-Slide Design for Closet Organization System, 12”x 4’, 1 Pack",https://m.media-amazon.com/images/I/41AW84VZNjL._AC_UL320_.jpg,34.55,4.3,False,100,Home Storage & Organization
B07XNMC4L4,"LEAVES AND TREES Y Stackable Kitchen Canisters Set, Pack of 5 Clear Glass Food Storage Jars Containers with Airtight Bamboo Lid for Candy, Cookie, Rice, Sugar, Flour, Pasta, Nuts",https://m.media-amazon.com/images/I/61yeF4Si-9L._AC_UL320_.jpg,25.98,4.7,False,700,Home Storage & Organization
B0B25DXG5W,"Heavy Duty Storage Straps with Handle, 3 Pieces 22 inch Garage Organization Extension Cord Organizer, Hook and Loop Organizer Hanger for Cords, Cables, Hoses, Rope, RV, Boat, Garage, Home",https://m.media-amazon.com/images/I/71mOTqTfX4L._AC_UL320_.jpg,16.99,4.6,False,0,Home Storage & Organization
B0BPL6FFN4,"Wall Hooks 13 lbs(Max), Wall Hangers Without Nails, Adhesive Wall Hooks, Waterproof and Rustproof to use Inside Kitchen, Bathroom, Home and Office,10 PCS",https://m.media-amazon.com/images/I/5106EXr+PJL._AC_UL320_.jpg,8.49,4.2,False,0,Home Storage & Organization
B08NF1X2HJ,"ComSaf Glass Spaghetti Pasta Storage Container with Lids 74oz Set of 3, Tall Clear Airtight Food Storage Jar with Bamboo Cover Kitchen Pantry Storage Container for Noodles Flour Cereal Coffee Beans",https://m.media-amazon.com/images/I/81myrcmvyzL._AC_UL320_.jpg,34.99,4.6,False,700,Home Storage & Organization
B0CHV9D2GF,85 Gallon Deck Box Outdoor Waterproof Large Resin Storage Box Patio Lockable Storage Container Porch Storage Bench (Black),https://m.media-amazon.com/images/I/71WHtVMkHxL._AC_UL320_.jpg,74.99,5.0,False,0,Home Storage & Organization
B003UEMD1M,"Ziploc Flexible Totes Clothes and Blanket Storage Bags, Perfect for Closet Organization and Storing Under Beds, Jumbo, 1 Count",https://m.media-amazon.com/images/I/91KY+rNZGCL._AC_UL320_.jpg,9.48,4.7,False,3000,Home Storage & Organization
B07WRYR4KZ,"Goplus Horizontal Storage Shed Outdoor, Multi-Function Storage Cabinet for Garden Yard Lawn, 6x3FT",https://m.media-amazon.com/images/I/618HDZdVYQL._AC_UL320_.jpg,339.98,3.0,False,0,Home Storage & Organization
B00DH8J24C,"Keter Factor 8x6 Large Resin Outdoor Storage Shed for Patio Furniture, Lawn Mower, Garden Accessories Yard Tools, and Pool Toys, Taupe",https://m.media-amazon.com/images/I/91SI725WkdL._AC_UL320_.jpg,1066.19,3.9,False,0,Home Storage & Organization
B00023S9US,"Unisex Adult CLC Custom Leathercraft C6 Canvas Waist Apron Two Pocket, White, One size fits all US",https://m.media-amazon.com/images/I/41KhhVht39L._AC_UL320_.jpg,3.89,4.5,False,1000,Home Storage & Organization
B0BTMWT9W9,"Rubbermaid Easy Find Lids Food Storage Containers, 0.5 Cup, Clear With Red Lids 12 Pack (12 Cups)",https://m.media-amazon.com/images/I/81RBKE-e5GL._AC_UL320_.jpg,15.37,4.8,False,800,Home Storage & Organization
